name,url,address,access,description,average_price,pet_dog_small,pet_dog_medium,pet_dog_large,pet_cat,pet_others,pet_otherInfo
FruttoRicco,https://r.gnavi.co.jp/e17b9k4n0000/?sc_dsp=rs_14096&sc_type=area&sc_area=jp,岐阜県岐阜市長良井田71,名鉄各務原線名鉄岐阜駅 車10分,岐阜市本格イタリアン,"平均予算：4,000円",テラス,テラス,テラス,テラス,テラス,
童子,https://r.gnavi.co.jp/p18du1bf0000/,千葉県夷隅郡大多喜町平沢1605,いずみ鉄道大多喜駅 車20分,ろばた焼き,"平均予算：6,000円",,,,,,
のどかの味処 みやちか,https://r.gnavi.co.jp/duu6n41t0000/,岐阜県郡上市美並町上田2525,長良川鉄道線木尾駅 徒歩20分,天然鮎料理専門店,"平均予算：3,000円",,,,,,
からあげとビール,https://r.gnavi.co.jp/9hc75xfm0000/,東京都杉並区高円寺南3-21-19,丸の内線新高円寺駅 徒歩4分,からあげ専門店,"平均予算：1,000円",,,,,,
かくれんぼ喫茶室,https://r.gnavi.co.jp/5epwas6n0000/,埼玉県秩父郡長瀞町本野上637-1,,レンタルカフェ,平均予算：500円,,,,,,
Olive,https://r.gnavi.co.jp/m970x23y0000/,千葉県南房総市白浜町白浜623-18,,飲食店,"平均予算：1,000円",,,,,,
ガネーシャガル 西荻窪店,https://r.gnavi.co.jp/a88stbj00000/,東京都杉並区上荻4-4-1,ＪＲ中央線西荻窪駅 徒歩10分,隠れ家　インド料理,"平均予算：2,500円",,,,,,
グリル万天,https://r.gnavi.co.jp/buzku41r0000/,鹿児島県鹿児島市小川町11-19,鹿児島市電桜島桟橋通駅 徒歩2分,食堂,平均予算：850円,,,,,,
磯料理 みずるめ,https://r.gnavi.co.jp/b848dg2g0000/,千葉県南房総市白浜町白浜627,JR内房線館山駅東口 バス30分,和風磯料理店,"平均予算：1,500円",,,,,,
グランツ　ムート,https://r.gnavi.co.jp/n29fm9ek0000/,熊本県阿蘇郡南阿蘇村久石2752-1,南阿蘇鉄道中松駅 車5分,パン・サンドウィッチ,平均予算：500円,,,,,,
もくようしゃ　カノン,https://r.gnavi.co.jp/2cemc0480000/,千葉県市原市潤井戸1105-1,京成千原線ちはら台駅 車6分,古民家レストラン,"平均予算：2,000円",,,,,,
Hawaiian Cafe ＆ Diner Teddy’s Bigger Burgers 表参道,https://r.gnavi.co.jp/e7dxpkpp0000/,東京都渋谷区神宮前6-28-5,地下鉄千代田線明治神宮前駅7番出口 徒歩1分,ハワイアンカフェ,"平均予算：1,500円",,,,,,
サクラ,https://r.gnavi.co.jp/sj3jst3w0000/,福岡県久留米市大善寺町宮本342-81,西鉄天神大牟田線西鉄安武駅 徒歩5分,インド料理・カレー,"平均予算：1,230円",,,,,,
海鮮道楽 為ちゃん,https://r.gnavi.co.jp/ssvpkd7s0000/,山形県寒河江市大字寒河江字内の袋-14-3,ＪＲ左沢線西寒河江駅 徒歩5分,海鮮料理店,"平均予算：1,500円",,,,,,
田舎のカフェ いろり庵,https://r.gnavi.co.jp/m9kyazz70000/,石川県七尾市満仁町ワ部53,ＪＲ七尾線和倉温泉駅 車10分,田舎暮らし体験型カフェ,"平均予算：2,500円",,,,,,
観音SOBA,https://r.gnavi.co.jp/6mx8kk5m0000/,長野県茅野市北山5513,,立ち食い屋台蕎麦,平均予算：800円,,,,,,
千里香 池袋店,https://r.gnavi.co.jp/r61y3kjc0000/,東京都豊島区西池袋1-21-1,地下鉄有楽町線池袋駅西口・北口 徒歩2分,炭火を使用しております,"平均予算：3,000円",,,,,,
Air（エアー）,https://r.gnavi.co.jp/d4nfmvv60000/,福岡県北九州市小倉北区浅野2-12-8,ＪＲ小倉駅北口 徒歩4分,レストラン&バー,"平均予算：5,000円",,,,,,
個室で味わう九州地鶏料理 吉蔵 ～YOSHIKURA～ 浦和店,https://r.gnavi.co.jp/ptytkyga0000/?sc_dsp=rs_13376&sc_type=area&sc_area=jp,埼玉県さいたま市浦和区仲町1-1-13,ＪＲ浦和駅 徒歩1分,24時迄営業・酒類OK,"平均予算：3,000円",店内,,,店内,店内,
スペインバル 本格地中海料理 アリアッチ 川崎ラチッタデッラ店,https://r.gnavi.co.jp/g254274/?sc_dsp=rs_14554&sc_type=area&sc_area=jp,神奈川県川崎市川崎区小川町1-18,ＪＲ川崎駅 徒歩5分,地中海料理,"平均予算：4,000円",テラス,テラス,テラス,テラス,テラス,
ヨックモック 青山本店 ブルー・ブリック・ラウンジ,https://r.gnavi.co.jp/ga7955v00000/?sc_dsp=rs_15870&sc_type=area&sc_area=jp,東京都港区南青山5-3-3,地下鉄銀座線表参道駅A5番出口 徒歩3分,表参道でティータイム,"平均予算：4,000円",テラス,テラス,テラス,テラス,テラス,
広島焼き とこしえ,https://r.gnavi.co.jp/4a4gw3ep0000/,東京都世田谷区三軒茶屋1-5-16,東急田園都市線三軒茶屋駅 徒歩8分,お好み焼きと鉄板焼き,"平均予算：2,500円",,,,,,
あづまうどん,https://r.gnavi.co.jp/ryjtg41m0000/,香川県高松市前田東町340-1,,うどん,平均予算：400円,,,,,,
米 伍代目 善太郎 zentaro 小川屋米穀店,https://r.gnavi.co.jp/mtvagfh20000/,愛知県名古屋市千種区天満通2-30,,お米屋のおにぎり,平均予算：450円,,,,,,
個室 デザインフードマーケット 新橋店,https://r.gnavi.co.jp/3zu0v6370000/?sc_dsp=rs_15802&sc_type=area&sc_area=jp,東京都港区新橋1-15-5,地下鉄銀座線新橋駅7番出口 徒歩1分,バル居酒屋宴会完全個室,"平均予算：4,000円",,,,,,
琉ミン,https://r.gnavi.co.jp/bzsseeat0000/,沖縄県名護市字為又266-4,沖縄高速道路許田I.C. 車20分,麺カフェ,"平均予算：1,500円",,,,,,
Manly 熊本店,https://r.gnavi.co.jp/2den13zk0000/,熊本県熊本市中央区南坪井町5-29,熊本電鉄藤崎線藤崎宮前駅 徒歩5分,オーストラリア料理,"平均予算：3,000円",,,,,,
喫茶 時 toki,https://r.gnavi.co.jp/kkb1p5160000/,石川県金沢市横川1-180,北陸鉄道石川線野々市駅 徒歩6分,喫茶,"平均予算：2,000円",,,,,,
BRASSERIE L’OBABON （ブラッスリー ロバボン）,https://r.gnavi.co.jp/p60bn48d0000/,兵庫県神戸市中央区元町通1-4-12,ＪＲ神戸線元町駅 徒歩3分,ビストロ,"平均予算：4,000円",,,,,,
琉辛豚イセザキ,https://r.gnavi.co.jp/d89cuynt0000/,沖縄県那覇市壺屋1-2-17,沖縄、那覇　各バス開南 徒歩5分,串焼き居酒屋,"平均予算：1,500円",,,,,,
ボートハウスカフェ,https://r.gnavi.co.jp/mv4j4s3h0000/,山口県光市室積松原22-7,山陽本線光駅 バス15分,イタリアン レストラン,"平均予算：1,280円",,,,,,
大円地山荘,https://r.gnavi.co.jp/35csr30e0000/,茨城県久慈郡大子町頃藤2211,JR水群線上小川駅 車10分,そば屋・民宿,平均予算：900円,,,,,,
島野菜カフェ リハロウビーチ,https://r.gnavi.co.jp/sprpg0ee0000/,沖縄県石垣市真栄里192-2,石垣空港,島野菜とパンケーキ,"平均予算：2,500円",,,,,,
味人 －AJITO－,https://r.gnavi.co.jp/5b8nc7w90000/,愛媛県大洲市肱川町宇和川3030,松山自動車道内子五十崎I.C. 車25分,食堂兼居酒屋,平均予算：800円,,,,,,
貸切チキンキング,https://r.gnavi.co.jp/gks5f44g0000/,兵庫県神戸市灘区徳井町4-1-3,,貸切カラオケレストラン,"平均予算：3,000円",,,,,,
カフェ ド マイセン,https://r.gnavi.co.jp/7kwk4m0w0000/,神奈川県足柄下郡箱根町強羅1300-407,,カフェ ピザ,"平均予算：1,500円",,,,,,
SUDA COFFEE,https://r.gnavi.co.jp/6mhzhw1s0000/,栃木県那須郡那須町高久乙593-402,東北自動車道那須I.C. 車5分,カフェ,平均予算：800円,,,,,,
メルシィ商店 厚木小野店舗,https://r.gnavi.co.jp/exr7ajkh0000/,神奈川県厚木市小野2293-3,,レストラン＆カフェ,"平均予算：1,500円",,,,,,
OZ’s BROADWAY CAFE,https://r.gnavi.co.jp/bp55cuzc0000/,兵庫県丹波篠山市南矢代106-6,,CAFE,"平均予算：1,000円",,,,,,
豊次朗,https://r.gnavi.co.jp/dxm7h4pj0000/,神奈川県川崎市高津区二子1-1-23,東急田園都市線二子新地駅 徒歩2分,居酒屋・豚料理,"平均予算：3,000円",,,,,,
ピッツァリーナ Pizzalina,https://r.gnavi.co.jp/dryvmjkz0000/,東京都世田谷区北沢3-30-3,京王井の頭線下北沢駅 徒歩6分,イタリアン×ピザ,"平均予算：4,000円",,,,,,
マサラ,https://r.gnavi.co.jp/7kepbw9a0000/,高知県香南市夜須町千切537-90,高知自動車道南国I.C. 車35分,インド料理レストラン,"平均予算：2,300円",,,,,,
カジュアルバル MANTRA～まんとら～ 堺筋本町店,https://r.gnavi.co.jp/18mknp000000/?sc_dsp=rs_13461&sc_type=area&sc_area=jp,大阪府大阪市中央区瓦町1-7-15,地下鉄堺筋線堺筋本町駅 徒歩4分,カジュアルイタリアバル,"平均予算：3,000円",テラス,テラス,,,,
海鮮個室居酒屋 宮本 綱島店,https://r.gnavi.co.jp/fxbsgk1n0000/?sc_dsp=rs_13014&sc_type=area&sc_area=jp,神奈川県横浜市港北区綱島西1-7-8,東急東横線綱島駅 徒歩1分,蒲田東口個室居酒屋,"平均予算：2,980円",,,,,,
個室で味わう九州地鶏料理 吉蔵 ～YOSHIKURA～ 浦和店,https://r.gnavi.co.jp/ptytkyga0000/?sc_dsp=rs_13376&sc_type=area&sc_area=jp,埼玉県さいたま市浦和区仲町1-1-13,ＪＲ浦和駅 徒歩1分,24時迄営業・酒類OK,"平均予算：3,000円",店内,,,店内,店内,
midium,https://r.gnavi.co.jp/cm5288x70000/,福岡県福岡市中央区大名1-1-20,西鉄天神大牟田線西鉄福岡（天神）駅 徒歩7分,ダイニングバー,"平均予算：3,000円",,,,,,
炭火串焼 鶏ジロー 菊川店,https://r.gnavi.co.jp/hn2adyt10000/,東京都墨田区菊川3-6-6,都営新宿線菊川駅 徒歩2分,炭火串焼と鶏料理,"平均予算：3,000円",,,,,,
ダイアモンドヘッド 夜カフェ＆バー,https://r.gnavi.co.jp/j19s41xb0000/,東京都西東京市柳沢6-7-8,西武新宿線西武柳沢駅南口 徒歩4分,夜カフェ＆バー,"平均予算：2,000円",,,,,,
Kitchen bar 新目黒茶屋,https://r.gnavi.co.jp/b979901/?sc_dsp=rs_12294&sc_type=area&sc_area=jp,東京都品川区上大崎2-13-22,ＪＲ目黒駅 徒歩2分,CURRY&バル,"平均予算：4,000円",店内,テラス,テラス,店内,,
SANDWICH SHOP OCEAN,https://r.gnavi.co.jp/a0ddc9sp0000/,東京都台東区根岸3-2-9,,アメリカンサンドイッチ,"平均予算：1,200円",,,,,,
ENCHANTE Herbal Cafe,https://r.gnavi.co.jp/erwuucy30000/,東京都狛江市猪方1-10-10,小田急小田原線狛江駅南口 徒歩10分,カフェ・スイーツ,"平均予算：1,200円",,,,,,
La・Kamt,https://r.gnavi.co.jp/bv8s77380000/,茨城県結城市結城8776-8,JR水戸線結城駅南口 徒歩20分,イタリアンレストラン,"平均予算：1,500円",,,,,,
伊勢松,https://r.gnavi.co.jp/56mbhwfc0000/,三重県伊勢市黒瀬町1237-22,,鰻と松坂牛レストラン,"平均予算：3,000円",,,,,,
BO－CHIRA,https://r.gnavi.co.jp/7v411db20000/,沖縄県那覇市牧志3-8-30,,バー,"平均予算：2,000円",,,,,,
cafe de flots,https://r.gnavi.co.jp/a75xgz0d0000/,香川県三豊市仁尾町仁尾乙165-1,ＪＲ予讃線比地大駅 車16分,cafe,"平均予算：1,050円",,,,,,
SOUNDS GOOD！ CAFE＆GALLERY,https://r.gnavi.co.jp/6yy2j1vr0000/,群馬県太田市南矢島町673-5,東武伊勢崎線（東武スカイツリーライン）太田駅南口 車15分,カフェ＆ブディック,"平均予算：1,000円",,,,,,
スサンタ　キッチン,https://r.gnavi.co.jp/r50famxy0000/,北海道旭川市東旭川町上兵村328,ＪＲ旭川駅 バス30分,スリランカ家庭料理店,"平均予算：1,200円",,,,,,
ラウンジ伊炉里,https://r.gnavi.co.jp/gd411zc20000/,福井県勝山市170-70 スキ-ジャム勝山,,ピザ・パスタ,"平均予算：1,500円",,,,,,
松里果樹園,https://r.gnavi.co.jp/89dbr3dn0000/,山梨県甲州市塩山 藤木1702,中央線塩山駅 バス10分,古民家風カフェ,"平均予算：1,000円",,,,,,
かじか亭,https://r.gnavi.co.jp/nx3g5mv80000/,愛媛県喜多郡内子町寺村251-1,ＪＲ内子駅 車20分,うどん,平均予算：650円,,,,,,
ランバージャック,https://r.gnavi.co.jp/edbra36k0000/,長野県上水内郡信濃町野尻45-3,信越線黒姫駅東口 車10分,洋食レストラン,"平均予算：1,030円",,,,,,
Sand Cafe,https://r.gnavi.co.jp/kzsmj32j0000/,千葉県南房総市千倉町瀬戸2908-1,,カフェ,"平均予算：1,000円",,,,,,
Cafe＆Gallery RAKU,https://r.gnavi.co.jp/agy04c1j0000/,静岡県三島市中央町7-7,JR東海道新幹線三島駅南口 徒歩9分,カフェ＆ギャラリー,平均予算：700円,,,,,,
四季彩 ひととき,https://r.gnavi.co.jp/shvcj0n50000/,新潟県新発田市貝屋32-5,,レストラン,"平均予算：1,026円",,,,,,
茶房みなとや,https://r.gnavi.co.jp/dgffp4xh0000/,岡山県倉敷市本町5-31,ＪＲ倉敷駅南口 徒歩20分,和風喫茶,平均予算：450円,,,,,,
御飯屋おはな,https://r.gnavi.co.jp/hg88pjfy0000/,福岡県糸島市志摩野北2461-2,,和食レストラン,"平均予算：1,600円",,,,,,
墨国回転鶏料理 福島高架下店,https://r.gnavi.co.jp/mf2hczmp0000/?sc_dsp=rs_13900&sc_type=area&sc_area=jp,大阪府大阪市福島区福島7-2-6,ＪＲ大阪環状線福島駅 徒歩3分,【メキシコ料理専門店】,"平均予算：2,500円",テラス,テラス,テラス,,,
酒楽酒酒酒 蔵,https://r.gnavi.co.jp/p5s6tbxc0000/?sc_dsp=rs_12754&sc_type=area&sc_area=jp,神奈川県川崎市中原区小杉町3-258,東急目黒線武蔵小杉駅 徒歩2分,6/1より通常営業再開,"平均予算：3,500円",テラス,テラス,テラス,テラス,テラス,
完全個室 THEM～ゼム～ 六本木,https://r.gnavi.co.jp/mc4xvuyy0000/?sc_dsp=rs_14852&sc_type=area&sc_area=jp,東京都港区六本木7-13-10,都営大江戸線六本木駅 徒歩2分,駅近合コン完全個室,"平均予算：6,000円",,,,,,
ケリノスギャラリーカフェ,https://r.gnavi.co.jp/p9w2e9fm0000/,奈良県生駒市門前町23-5,近鉄生駒駅 車6分,カフェ,平均予算：800円,,,,,,
Vieni,https://r.gnavi.co.jp/cbr1b0gh0000/,兵庫県神戸市中央区中山手通1-22-26,ＪＲ三宮駅 徒歩7分,イタリアン、カフェ,"平均予算：1,000円",,,,,,
Punalu’u （プナルウ）,https://r.gnavi.co.jp/dxnfj37d0000/,千葉県八千代市ゆりのき台4-8-1,,ハワイアンカフェバー,"平均予算：2,000円",,,,,,
個室ダイニング 裏NO庭 名駅店,https://r.gnavi.co.jp/10ht11fe0000/?sc_dsp=rs_14014&sc_type=area&sc_area=jp,愛知県名古屋市中村区名駅4-5-15,ＪＲ名古屋駅 徒歩1分,個室 黒毛和牛 鮮魚,"平均予算：3,500円",テラス,テラス,,,,
Mie Coco,https://r.gnavi.co.jp/6r3xxy4t0000/,埼玉県川越市幸町3-7,東武東上線川越駅 徒歩15分,カフェ＆バー,"平均予算：3,000円",,,,,,
望ヶ丘,https://r.gnavi.co.jp/jc5vd2090000/,岡山県備前市吉永町加賀美1393,ＪＲ山陽本線吉永駅 バス35分,キャンプ併設レストラン,"平均予算：1,000円",,,,,,
イーズパッション,https://r.gnavi.co.jp/jdutphe00000/,埼玉県飯能市双柳632-1,ＪＲ八高線東飯能駅東口 徒歩10分,飯能 美肌イタリアン,"平均予算：3,500円",,,,,,
フジヤマキッチン,https://r.gnavi.co.jp/3v4vv3e10000/,山梨県南都留郡山中湖村平野506-296,,山中湖湖畔　レストラン,"平均予算：3,000円",,,,,,
Cafe “THERE”,https://r.gnavi.co.jp/434c021s0000/,広島県広島市東区牛田本町1-9-16,広電白島線白島駅 徒歩11分,大人の隠れ家カフェバー,平均予算：900円,,,,,,
ピザ＆パスタ ドメニカーナ,https://r.gnavi.co.jp/240v9ctz0000/,島根県鹿足郡吉賀町蔵木1081,ＪＲ広島駅 車90分,ピザ パスタ,"平均予算：1,500円",,,,,,
瀬戸内洋食　ともしび,https://r.gnavi.co.jp/98gha6wh0000/,広島県尾道市久保1-3-37,ＪＲ山陽本線尾道駅南口 徒歩17分,バル ホテル,"平均予算：3,000円",,,,,,
Ｃａｆｅ ＶＥＴ,https://r.gnavi.co.jp/jvgczuy40000/,北海道札幌市西区西野4条9-1-1,地下鉄東西線宮の沢駅 徒歩10分,カフェ,平均予算：700円,,,,,,
焼鳥・串揚・串焼　　さきたま商店,https://r.gnavi.co.jp/mpn4m94x0000/,埼玉県さいたま市岩槻区笹久保1038-2,,焼鳥　串揚　串焼　居酒,"平均予算：1,500円",,,,,,
大久保茶屋,https://r.gnavi.co.jp/n2tpaagx0000/,福井県福井市小山谷町34-9,ＪＲ北陸本線福井駅 車13分,足羽山　郷土料理,"平均予算：2,000円",,,,,,
月待の滝もみじ苑,https://r.gnavi.co.jp/ah0543z10000/,茨城県久慈郡大子町川山嵯峨草1369-1,JR水郡線下野宮駅 徒歩30分,そば,"平均予算：1,500円",,,,,,
BISTRO菜の卓,https://r.gnavi.co.jp/dj5c4vje0000/,大分県日田市本町8-21,JR久大線日田駅 徒歩5分,洋風居酒屋,"平均予算：3,000円",,,,,,
ＤＵＫＥ ＳＡＬＯＯＮ,https://r.gnavi.co.jp/6j4xzjvp0000/,東京都世田谷区北沢2-14-7,小田急線下北沢駅南口 徒歩3分,おしゃれで優しいバー,"平均予算：2,300円",,,,,,
ENOTECA D’ORO PREMIO,https://r.gnavi.co.jp/cjmztftt0000/,茨城県稲敷郡阿見町よしわら4-1-1,ＪＲ常磐線荒川沖駅東口 車20分,茨城×イタリアン×ピザ,"平均予算：1,650円",,,,,,
町屋カフェｎｏｃｏｎｏｃｏ,https://r.gnavi.co.jp/8r9wbt5d0000/,奈良県高市郡高取町大字上土佐57,近鉄壷阪山駅 徒歩15分,カフェ,平均予算：800円,,,,,,
エル・パティオ牧場,https://r.gnavi.co.jp/jpgv46xj0000/,熊本県阿蘇市一の宮町三野2305-1,ＪＲ豊肥本線宮地駅 車15分,洋風レストラン,"平均予算：1,200円",,,,,,
ハンプティー ダンプティー 太田飯塚店,https://r.gnavi.co.jp/nb4bv4w80000/,群馬県太田市飯塚町801-1,東武伊勢崎線（東武スカイツリーライン）太田駅 車10分,生活雑貨店,"平均予算：1,000円",,,,,,
ビアテラス 8EIGHTH BEEF ‐エイトビーフ‐ 神戸umieモザイク店,https://r.gnavi.co.jp/bwegzx0w0000/?sc_dsp=rs_13527&sc_type=area&sc_area=jp,兵庫県神戸市中央区東川崎町1-6-1,神戸市営地下鉄海岸線（夢かもめ）ハーバーランド駅 徒歩9分,ステーキ＆ハンバーガー,"平均予算：2,800円",テラス,テラス,テラス,テラス,テラス,
キンカウーカ グリル＆オイスターバー 横浜ベイクォーター店,https://r.gnavi.co.jp/a134412/?sc_dsp=rs_12158&sc_type=area&sc_area=jp,神奈川県横浜市神奈川区金港町1-10,ＪＲ横浜駅東口 徒歩10分,牡蠣×ワインを愉しむ,"平均予算：4,500円",テラス,テラス,テラス,テラス,,
カジュアルバル MANTRA～まんとら～ 堺筋本町店,https://r.gnavi.co.jp/18mknp000000/?sc_dsp=rs_13461&sc_type=area&sc_area=jp,大阪府大阪市中央区瓦町1-7-15,地下鉄堺筋線堺筋本町駅 徒歩4分,カジュアルイタリアバル,"平均予算：3,000円",テラス,テラス,,,,
ポルトメゾン・ルームス,https://r.gnavi.co.jp/3stj171d0000/,千葉県南房総市千倉町川口301,,カフェ＆レストラン,"平均予算：1,500円",,,,,,
韓国居酒屋 KANG 真臺灣 漢,https://r.gnavi.co.jp/mwdmef400000/,静岡県浜松市中区上島7-3-33,,レストラン、居酒屋,"平均予算：2,000円",,,,,,
そばきり祥香,https://r.gnavi.co.jp/s703ms8w0000/,山梨県北杜市小淵沢町1541-1,,蕎麦・うどん・肴,"平均予算：2,500円",,,,,,
SOLiS GRANDE,https://r.gnavi.co.jp/eu0acdst0000/?sc_dsp=rs_14516&sc_type=area&sc_area=jp,沖縄県中頭郡北谷町字美浜9-49,那覇空港 車45分,絶景も楽しむイタリアン,"平均予算：2,500円",テラス,テラス,テラス,テラス,テラス,
恋花亭,https://r.gnavi.co.jp/mcamj4av0000/,宮崎県西都市大字茶臼原785-4,東九州自動車道西都I.C. 車10分,カフェスイーツ,"平均予算：1,000円",,,,,,
奥ちゃん,https://r.gnavi.co.jp/s0ucud890000/,埼玉県入間市東町2-2-42,西武池袋線入間市駅南口 徒歩17分,やきとり屋,"平均予算：2,000円",,,,,,
中華飯店 吟月,https://r.gnavi.co.jp/7fndfevv0000/,静岡県静岡市葵区伝馬町7-8,JR東海道線静岡駅 徒歩5分,中華料理,平均予算：700円,,,,,,
JACK GAIN,https://r.gnavi.co.jp/b1mf82nw0000/,三重県伊賀市上野忍町2678-1,伊賀鉄道伊賀線上野市駅 徒歩2分,DOGカフェ,平均予算：500円,,,,,,
Elly’s cafe,https://r.gnavi.co.jp/3xtra5uh0000/,沖縄県国頭郡恩納村瀬良垣32番地,,カフェスイーツ・ランチ,"平均予算：1,000円",,,,,,
KIKI－HOUSE,https://r.gnavi.co.jp/e40krfcf0000/,岩手県盛岡市神明町1-19,各循環バス盛岡バスセンター 徒歩5分,ダイニング＆バー,"平均予算：3,000円",,,,,,
もりた,https://r.gnavi.co.jp/9gx6kyb20000/,青森県十和田市大字奥瀬字十和田湖畔休屋486,ＪＲ東北新幹線七戸十和田駅 バス90分,御食事処,"平均予算：1,500円",,,,,,
あげパン串カツ　まりりん,https://r.gnavi.co.jp/4uy930ke0000/,岐阜県海津市平田町三郷1984,,たこやき,平均予算：800円,,,,,,
Bar What’s Micael？,https://r.gnavi.co.jp/2cmc02ct0000/,大阪府藤井寺市岡1-16-25,,BAR,"平均予算：2,000円",,,,,,
ワイン酒場 ツキアカリ,https://r.gnavi.co.jp/apbe98rt0000/,東京都品川区西五反田4-2-9,東急目黒線不動前駅 徒歩5分,ワイン酒場,"平均予算：2,750円",,,,,,
我夢,https://r.gnavi.co.jp/5eaeg5z40000/,兵庫県西宮市山口町下山口1650-106,,喫茶・軽食,平均予算：500円,,,,,,
KopiLuwak,https://r.gnavi.co.jp/nf7ctd770000/,神奈川県逗子市小坪5-24-1,ＪＲ横須賀線逗子駅 車10分,小坪カフェコピルアック,"平均予算：1,000円",,,,,,
Ｔａｎｔｏ　Ｖｅｒｄｅ 伊勢原　イタリアン　タントベルデ,https://r.gnavi.co.jp/8tuam4yw0000/,神奈川県伊勢原市大住台3-3-1,,イタリアン,"平均予算：2,000円",,,,,,
ほりかわ,https://r.gnavi.co.jp/56rz9pfg0000/,沖縄県那覇市首里真和志町1-27,ゆいレール首里駅 車5分,沖縄そば・沖縄料理,平均予算：900円,,,,,,
ピザハウス Erba（エルバ）,https://r.gnavi.co.jp/c0g5bn640000/,奈良県吉野郡下市町平原477-1,,ピザハウス,"平均予算：1,200円",,,,,,
プードル,https://r.gnavi.co.jp/gnbpe76u0000/,大阪府泉南郡熊取町五門西1-10-1,ＪＲ阪和線熊取駅 徒歩10分,洋食＆フレンチ,"平均予算：3,000円",,,,,,
カフェテラス ラメール,https://r.gnavi.co.jp/gsb5ywef0000/,山口県宇部市東岐波648-1,ＪＲ宇部線岐波駅 車5分,カフェレストラン,"平均予算：1,000円",,,,,,
炭火焼鳥専門×全席個室居酒屋 吟八 日本橋店,https://r.gnavi.co.jp/8ptvkfuj0000/?sc_dsp=rs_13015&sc_type=area&sc_area=jp,東京都中央区日本橋室町1-11-2,地下鉄銀座線三越前駅 徒歩2分,日本橋個室居酒屋,"平均予算：2,980円",,,,,,
杏仁香,https://r.gnavi.co.jp/sg562v6r0000/?sc_dsp=rs_15476&sc_type=area&sc_area=jp,鹿児島県鹿児島市東千石町3-41,鹿児島市電（系統1）高見馬場駅 徒歩5分,鹿児島の四川料理,"平均予算：4,000円",テラス,テラス,,テラス,テラス,
料理倶楽部,https://r.gnavi.co.jp/g156600/?sc_dsp=rs_15495&sc_type=area&sc_area=jp,東京都港区南青山4-16-12,地下鉄表参道駅A4出口 徒歩7分,厳選食材の和洋創作料理,"平均予算：3,500円",店内,,,,,
にくきゅうカフェ,https://r.gnavi.co.jp/5xjmnc2y0000/,東京都西東京市南町6-7-1,西武新宿線田無駅南口 徒歩15分,ペット入店可の喫茶店,平均予算：980円,,,,,,
SPROUT,https://r.gnavi.co.jp/3j5dtmje0000/,和歌山県日高郡美浜町大字吉原958-222,紀州鉄道紀州鉄道線西御坊駅 車6分,カフェ,"平均予算：1,000円",,,,,,
天空房 山水,https://r.gnavi.co.jp/724pb0mf0000/,長崎県東彼杵郡川棚町新谷郷1077-1,ＪＲ大村線ハウステンボス駅東口 車5分,十割そば,"平均予算：1,000円",,,,,,
ヨックモック 青山本店 ブルー・ブリック・ラウンジ,https://r.gnavi.co.jp/ga7955v00000/?sc_dsp=rs_15870&sc_type=area&sc_area=jp,東京都港区南青山5-3-3,地下鉄銀座線表参道駅A5番出口 徒歩3分,表参道でティータイム,"平均予算：4,000円",テラス,テラス,テラス,テラス,テラス,
吉丸,https://r.gnavi.co.jp/60aj5hp00000/,静岡県賀茂郡河津町梨本1197-66,東名高速道路沼津I.C. 車90分,おみやげセンター,平均予算：680円,,,,,,
すずの駅,https://r.gnavi.co.jp/kuyg0gj10000/,鹿児島県鹿児島市下福元町9716-2,ＪＲ指宿枕崎線谷山駅 車15分,食事処道の駅,平均予算：580円,,,,,,
CORDUROY cafe,https://r.gnavi.co.jp/n10uj1n60000/,福岡県福岡市中央区大名1-15-35,西鉄天神大牟田線西鉄福岡（天神）駅 徒歩5分,ダイニングカフェ＆バー,"平均予算：1,500円",,,,,,
Cafe．．．W,https://r.gnavi.co.jp/f2z72vhm0000/,福岡県春日市小倉6-1,西鉄天神大牟田線井尻駅 車7分,カフェ＆バー,"平均予算：1,000円",,,,,,
おんせん宿森山荘みどりの湯,https://r.gnavi.co.jp/k4tzgapz0000/,岩手県岩手郡雫石町橋場国見温泉,ＪＲ田沢湖線雫石駅 車30分,源泉旅館,"平均予算：2,000円",,,,,,
Olu’olu Cafe,https://r.gnavi.co.jp/18rnjvck0000/,東京都世田谷区池尻1-11-1,東急田園都市線池尻大橋駅 徒歩10分,ヴィーガンカフェ,"平均予算：1,500円",,,,,,
はんちくてい,https://r.gnavi.co.jp/bgjnj7an0000/,岐阜県高山市八軒町1-95,JR高山駅より 徒歩13分,飲食・菓子製造業,"平均予算：1,100円",,,,,,
みつや 星田店,https://r.gnavi.co.jp/paymy0kx0000/,大阪府交野市星田3-9-18,JR片町線星田駅 徒歩10分,たこ焼き・お好み焼き,"平均予算：1,000円",,,,,,
そば処たちそば,https://r.gnavi.co.jp/jt848etm0000/,秋田県秋田市南通亀の町1-3,秋田市中心市街地循環バス「ぐるる」五丁目橋 徒歩2分,そば うどん 丼もの,平均予算：700円,,,,,,
