name,url,address,access,description,average_price,pet_dog_small,pet_dog_medium,pet_dog_large,pet_cat,pet_others,pet_otherInfo
ワインカフェ Buddy’s,https://r.gnavi.co.jp/65bw3jzh0000/,山梨県南都留郡富士河口湖町小立4290-1,富士急行河口湖線河口湖駅 車5分,カフェレストラン,"平均予算：4,000円",,,,,,
BAR CLUB NOUVEAU,https://r.gnavi.co.jp/ennn1w000000/?sc_dsp=rs_15444&sc_type=area&sc_area=jp,沖縄県中頭郡北谷町美浜9-7,ゆいレールてだこ浦西駅 車19分,北谷ダイニングバー,"平均予算：3,000円",テラス,テラス,テラス,テラス,テラス,
TheCAFE L．D．K,https://r.gnavi.co.jp/bdv4yez40000/,山梨県甲斐市篠原274-1,ＪＲ中央本線竜王駅南口 徒歩15分,カフェレストラン,"平均予算：2,000円",,,,,,
Lunch＆Cafe 風,https://r.gnavi.co.jp/38cbrfv10000/,北海道上川郡美瑛町新星第三,,カフェレストラン,"平均予算：1,500円",,,,,,
濱,https://r.gnavi.co.jp/nwznrg7c0000/,兵庫県神戸市兵庫区石井町5-1-3,ＪＲ東海道本線三宮駅 バス13分,珈琲店,平均予算：350円,,,,,,
Chou＆Cream,https://r.gnavi.co.jp/51f2zzus0000/,愛知県安城市三河安城町1-9-2,ＪＲ三河安城駅 徒歩3分,イタリアンカフェバー,"平均予算：2,500円",,,,,,
さくら,https://r.gnavi.co.jp/3ees1em30000/,東京都町田市山崎町2200 山崎団地名店街3-18-103,小田急小田原線町田駅 バス20分,和風居酒屋,"平均予算：3,000円",,,,,,
リバーサイド園ヨリタ 茶房えん,https://r.gnavi.co.jp/gwvf3z3p0000/,愛知県新城市庭野字萩野23,ＪＲ新城駅 徒歩15分,喫茶店,平均予算：600円,,,,,,
スイーツパーラー十字屋商店,https://r.gnavi.co.jp/d65utng60000/,岡山県真庭市中396-1,,スイーツ・カフェ,"平均予算：1,000円",,,,,,
Wine cafe Vin Bien～ばんびあん～,https://r.gnavi.co.jp/k6xfyw7y0000/,東京都大田区新蒲田3-1-1,ＪＲ京浜東北線蒲田駅西口 徒歩10分,イタリアン カフェバー,"平均予算：3,500円",,,,,,
WENT．（ダブルエントランス）,https://r.gnavi.co.jp/atfxx10c0000/,東京都中央区新川1-9-3,地下鉄日比谷線茅場町駅3番出口 徒歩5分,各種お集まりスペース◎,"平均予算：2,500円",,,,,,
Oh Yeah！ 美浜　デポアイランド店,https://r.gnavi.co.jp/rekk0ekw0000/,沖縄県中頭郡北谷町字美浜9-39 2F,,バー,"平均予算：2,000円",,,,,,
Italian kitchen mountee,https://r.gnavi.co.jp/7rp6adrr0000/,岩手県北上市青柳町2-7-7,ＪＲ線北上駅 徒歩10分,イタリア料理店,"平均予算：3,500円",,,,,,
グリルシェフ,https://r.gnavi.co.jp/frz81dd10000/,栃木県那須郡那須町大字湯本440-4,ＪＲ東北本線黒磯駅 車30分,那須の洋食,"平均予算：1,500円",,,,,,
ハートランド,https://r.gnavi.co.jp/natcvgne0000/,千葉県鴨川市前原80,ＪＲ外房線安房鴨川駅 徒歩10分,ダイニングバー,"平均予算：2,000円",,,,,,
カフェラテ,https://r.gnavi.co.jp/8dz34pg80000/,秋田県秋田市土崎港西1-10-45,ＪＲ奥羽本線土崎駅 徒歩10分,カフェ,平均予算：750円,,,,,,
manis＊manis,https://r.gnavi.co.jp/9ty0caez0000/,岡山県岡山市南区郡2980-136,ＪＲ岡山駅 バス30分,cafe,"平均予算：1,000円",,,,,,
羽置の里 びりゅう館,https://r.gnavi.co.jp/hb9cfzmj0000/,山梨県上野原市西原6931,中央道上野原I.C 車40分,そば,"平均予算：1,000円",,,,,,
テラスビアガーデン 火だるま荘 渋谷道玄坂,https://r.gnavi.co.jp/h13xj3290000/,東京都渋谷区道玄坂1-15-10,京王井の頭線渋谷駅西口 徒歩1分,渋谷鉄板ワインビストロ,"平均予算：4,000円",,,,,,
溶岩焼き×個室肉バル 29house 町田駅前店,https://r.gnavi.co.jp/jkbuubya0000/?sc_dsp=rs_14630&sc_type=area&sc_area=jp,東京都町田市原町田6-10-10,ＪＲ横浜線町田駅 徒歩1分,溶岩焼き×肉寿司,"平均予算：3,000円",店内,店内,店内,,,
渋谷ビアガーデン テラスで贅沢BBQ H2【エイチツー】,https://r.gnavi.co.jp/jg0wc4ws0000/?sc_dsp=rs_14719&sc_type=area&sc_area=jp,東京都渋谷区道玄坂2-8-5,ＪＲ渋谷駅ハチ公口 徒歩1分,広々スペースで貸切宴会,"平均予算：3,000円",店内テラス,,,,,
Lau－Lau（ラウラウ） 麻布十番店,https://r.gnavi.co.jp/a023700/?sc_dsp=rs_12145&sc_type=area&sc_area=jp,東京都港区麻布十番2-14-2,地下鉄麻布十番駅4番出口 徒歩1分,麻布トップのコスパ！！,"平均予算：2,500円",テラス,テラス,,テラス,テラス,
喫茶 かっぺ,https://r.gnavi.co.jp/6kfmfkwk0000/,岐阜県中津川市馬籠4316-1,ＪＲ中央本線中津川駅 バス30分,喫茶店,平均予算：500円,,,,,,
sounds like cafe,https://r.gnavi.co.jp/ca2jy9eu0000/,長野県北安曇郡白馬村北城3020-504,JR大糸線白馬駅 徒歩20分,カフェ,"平均予算：1,000円",,,,,,
珈琲焙煎工房 みさご珈琲,https://r.gnavi.co.jp/85zjf8u90000/,兵庫県宝塚市山本丸橋1-5-31,阪急電車宝塚線山本駅南口 徒歩7分,ビーンズショップ,平均予算：900円,,,,,,
厨（KURIYA）神保町本店 神戸牛＆シチリアワイン,https://r.gnavi.co.jp/atgs09bt0000/?sc_dsp=rs_14919&sc_type=area&sc_area=jp,東京都千代田区一ツ橋2-6-12,都営新宿線神保町駅 徒歩2分,神保町の神戸牛専門店,"平均予算：5,000円",テラス,,,,,
和伊わいMANBOW,https://r.gnavi.co.jp/artes81a0000/,埼玉県川越市砂936-2,,イタリアンダイニング,"平均予算：3,000円",,,,,,
太陽の皿,https://r.gnavi.co.jp/e2rwjd580000/,福岡県糸島市泊844-1,,ビュッフェレストラン,"平均予算：2,200円",,,,,,
アンクル　スティーブンス,https://r.gnavi.co.jp/e1bur4yt0000/,長野県北安曇郡白馬村八方ゴンドラ通5148,JR大糸線白馬駅 車10分,メキシカン,"平均予算：2,900円",,,,,,
芳葉,https://r.gnavi.co.jp/bhs76fw30000/,千葉県千葉市花見川区幕張町5-477-18,JR総武線幕張駅南口 徒歩3分,中華料理,"平均予算：1,000円",,,,,,
権現からめもち,https://r.gnavi.co.jp/8wt3ptg20000/,神奈川県足柄下郡箱根町元箱根80-1,箱根登山鉄道鉄道線箱根湯本駅 バス50分,お休み処,"平均予算：1,000円",,,,,,
カレー処 ヤサカ,https://r.gnavi.co.jp/43yhsww40000/,静岡県浜松市中区領家1-7-30,ＪＲ浜松駅南口 車7分,自然志向カレー,"平均予算：1,300円",,,,,,
カフェ＆バー アンブロジア 東大阪,https://r.gnavi.co.jp/n2j5v4rx0000/,大阪府東大阪市東山町18-20,近鉄けいはんな線新石切駅 徒歩8分,カフェ・ダイニングバー,"平均予算：1,000円",,,,,,
渋谷 cafe HOFF,https://r.gnavi.co.jp/4m20dxsn0000/,東京都渋谷区初台2-11-11,都営新宿初台駅南口 10分,初台坂下にあるカフェ,"平均予算：2,500円",,,,,,
ＫＯＭＡＩＣＨＩ＆ＣＡＦＥ,https://r.gnavi.co.jp/f9cw4umr0000/,東京都世田谷区駒沢1-20-7,東急田園都市線駒沢大学駅 徒歩6分,隠れ家ダイニングカフェ,"平均予算：1,300円",,,,,,
銀座みかわや,https://r.gnavi.co.jp/9sysrjnb0000/,東京都中央区銀座4-7-12,地下鉄銀座駅 徒歩2分,銀座／老舗の洋食屋,"平均予算：8,000円",,,,,,
粋庵,https://r.gnavi.co.jp/gk14h8ak0000/,和歌山県紀の川市名手西野363,JR和歌山線名手駅 徒歩5分,手打そばうどん処,平均予算：900円,,,,,,
森のぱん屋さん,https://r.gnavi.co.jp/6k0yaj6d0000/,和歌山県海草郡紀美野町坂本723-1,ＪＲ海南駅 車30分,パン店,平均予算：500円,,,,,,
Pistachionik,https://r.gnavi.co.jp/43xbwbd10000/,神奈川県藤沢市片瀬海岸1-12-7,,ピスタチオ料理専門店,"平均予算：2,000円",,,,,,
お菓子な茶店 ちゃいぶ,https://r.gnavi.co.jp/nsv0m91s0000/,長野県茅野市北山5522-188,,カフェ,平均予算：800円,,,,,,
Book Cafe Den,https://r.gnavi.co.jp/h04g0zum0000/,東京都調布市上石原2-22-3,京王線西調布駅南口 徒歩5分,Cafe,平均予算：500円,,,,,,
江戸や鮨八 鷺宮店,https://r.gnavi.co.jp/51hrg13d0000/,東京都中野区鷺宮3-15-10,西武新宿線鷺ノ宮駅 徒歩2分,鷺ノ宮で新鮮な魚介類,"平均予算：3,000円",,,,,,
ワイズドッグカフェ　ル・ジャルダン,https://r.gnavi.co.jp/bzu027490000/,広島県広島市中区東千田町1-1-52 ひろしまガ-デンガ-デンコモンセンタ-棟1F,広島電鉄宇品線日赤病院前伊 徒歩2分,ドッグカフェ,"平均予算：1,000円",,,,,,
料理倶楽部,https://r.gnavi.co.jp/g156600/?sc_dsp=rs_15495&sc_type=area&sc_area=jp,東京都港区南青山4-16-12,地下鉄表参道駅A4出口 徒歩7分,厳選食材の和洋創作料理,"平均予算：3,500円",店内,,,,,
SGROSSO TOKYO ‐エスグロッソ東京‐,https://r.gnavi.co.jp/a996300/?sc_dsp=rs_15401&sc_type=area&sc_area=jp,東京都渋谷区道玄坂1-11-3,ＪＲ渋谷駅 徒歩1分,肉×魚×野菜イタリアン,"平均予算：3,000円",,,,,,
和風ダイニング 澄仙,https://r.gnavi.co.jp/p426800/?sc_dsp=rs_14121&sc_type=area&sc_area=jp,神奈川県横浜市港北区新横浜2-14-24,ＪＲ横浜線新横浜駅 徒歩3分,新横浜 和食 接待,"平均予算：6,000円",テラス,テラス,テラス,テラス,テラス,
空,https://r.gnavi.co.jp/pushc3440000/,大阪府泉佐野市大木7,南海本線泉佐野駅 車30分,創作料理,"平均予算：1,000円",,,,,,
crossdesign EXE,https://r.gnavi.co.jp/hmrhdrww0000/,東京都千代田区神田佐久間町3-29,ＪＲ秋葉原駅昭和通り口 徒歩5分,パーティースペースバー,"平均予算：2,000円",,,,,,
TRATTORIA BUBU,https://r.gnavi.co.jp/e3suxraj0000/,神奈川県川崎市高津区久地1-9-7,東急田園都市線高津駅 徒歩8分,トラットリア,"平均予算：3,500円",,,,,,
全席個室×炭火焼鳥食べ放題 なごみ 蒲田駅前店,https://r.gnavi.co.jp/9x5mp6560000/?sc_dsp=rs_13011&sc_type=area&sc_area=jp,東京都大田区西蒲田7-67-5,ＪＲ京浜東北線蒲田駅西口 徒歩1分,蒲田西口完全個室居酒屋,"平均予算：3,000円",店内,店内,店内,店内,店内,
Thies：Cafe,https://r.gnavi.co.jp/cbp3b73v0000/,東京都江戸川区瑞江1-46-5,,カフェ　セネガル料理,平均予算：300円,,,,,,
カフェ くるり,https://r.gnavi.co.jp/mb8h8d4b0000/,宮城県仙台市若林区木ノ下3-16-24,仙台市営地下鉄東西線薬師堂駅 徒歩1分,カフェレストラン,"平均予算：2,000円",,,,,,
伏見駅×パーティー Coat of Arms ～コートオブアームズ～,https://r.gnavi.co.jp/8xp3rsds0000/,愛知県名古屋市中区錦2-6-12,地下鉄桜通線丸の内駅 徒歩3分,本格派の英国酒場,"平均予算：2,500円",,,,,,
ルーン・ウィッチズグロット,https://r.gnavi.co.jp/pubmns4t0000/,東京都北区神谷3-45-5,,薬膳カフェバー,"平均予算：3,000円",,,,,,
バーカルー Bar Carou,https://r.gnavi.co.jp/4x2n8g980000/,神奈川県横浜市南区中島町4-85,横浜市営地下鉄弘明寺駅 徒歩1分,バー,"平均予算：1,500円",,,,,,
野毛ホルモンビル 大夢,https://r.gnavi.co.jp/83n823bd0000/,神奈川県横浜市中区野毛町2-78-1,横浜市営地下鉄桜木町駅南2B出口 徒歩5分,野毛ホルモンビル酒場,"平均予算：2,980円",,,,,,
Kona Kona Cafe’天草本店,https://r.gnavi.co.jp/fhdsyh900000/,熊本県天草市本渡町広瀬176-63,,Kona Kona Cafe’,平均予算：500円,,,,,,
太陽のトマト麺 大塚北口店,https://r.gnavi.co.jp/s5k0vddj0000/,東京都豊島区北大塚2-8-8,ＪＲ山手線大塚駅北口 徒歩2分,ラーメン,"平均予算：1,000円",,,,,,
古宇利島カフェ,https://r.gnavi.co.jp/5y4bz4sb0000/,沖縄県国頭郡今帰仁村字古宇利325-1,沖縄自動車道許田I.C. 車40分,カフェ＆レストラン,"平均予算：1,500円",,,,,,
Ryokken,https://r.gnavi.co.jp/jz3sn98t0000/,北海道旭川市永山7条14-4-4,道北バス永山6条14丁目停留所 徒歩1分,カフェ,"平均予算：1,200円",,,,,,
YAMBAR Ishigaki,https://r.gnavi.co.jp/cgpzda2k0000/,沖縄県石垣市美崎町16-14-1B,,BAR,"平均予算：1,500円",,,,,,
BISTRO TORICOYA（ビストロ トリコヤ）,https://r.gnavi.co.jp/4wh9ypsg0000/,東京都渋谷区恵比寿南1-11-2,地下鉄日比谷線恵比寿駅 徒歩3分,おしゃれ本格ビストロ,"平均予算：5,000円",,,,,,
cafe ties （カフェ タイズ）,https://r.gnavi.co.jp/n8jfemm00000/,長野県伊那市西町5863-1,,カフェ・スイーツ・軽食,"平均予算：1,000円",,,,,,
もっきりや,https://r.gnavi.co.jp/a7g3exvc0000/,石川県金沢市柿木畠3-6,JR北陸本線金沢駅東口 バス10分,ライブ＆カフェ,"平均予算：1,000円",,,,,,
Bar GOOD SPEED,https://r.gnavi.co.jp/nekn5epg0000/,神奈川県大和市南林間1-9-1,小田急線南林間駅西口 徒歩2分,バー,"平均予算：1,500円",,,,,,
レークヒル ファーム,https://r.gnavi.co.jp/ga37ksp50000/,北海道虻田郡洞爺湖町花和127,ＪＲ室蘭本線洞爺駅 車15分,ファーム　レストラン,"平均予算：1,100円",,,,,,
湯元屋,https://r.gnavi.co.jp/jb02p5cz0000/,静岡県静岡市葵区梅ケ島5258-13,新東名高速道路新静岡I.C. 車50分,おでん・そば・ジビエ,"平均予算：1,500円",,,,,,
沖縄 あっぱりしゃん 枚方店,https://r.gnavi.co.jp/c658602/?sc_dsp=rs_14366&sc_type=area&sc_area=jp,大阪府枚方市新町1-2-10,京阪本線枚方市駅北口 徒歩2分,老若男女楽しめる沖縄！,"平均予算：3,000円",店内,,,,,
Meson del Puerto,https://r.gnavi.co.jp/g303102/?sc_dsp=rs_14559&sc_type=area&sc_area=jp,埼玉県さいたま市大宮区桜木町1-5-3,ＪＲ大宮駅西口 徒歩1分,本場スペインバル,"平均予算：4,000円",,,,,,
ルポンドレ・ハルヤ,https://r.gnavi.co.jp/7uz2m6up0000/?sc_dsp=rs_15776&sc_type=area&sc_area=jp,岡山県岡山市東区西大寺浜166-1,ＪＲ赤穂線西大寺駅 車7分,チーズとワイン欧風料理,"平均予算：2,000円",テラス,テラス,,テラス,テラス,
cherry－cafe,https://r.gnavi.co.jp/md70p9e20000/,大阪府泉佐野市日根野4619-3,JR阪和線日根野駅 徒歩15分,ペットも入れるカフェ,"平均予算：1,100円",,,,,,
donisbar,https://r.gnavi.co.jp/brgg0y3a0000/,香川県小豆郡土庄町甲270-1,土庄港 車10分,自然派ワインバー,"平均予算：3,000円",,,,,,
うなぎの三河,https://r.gnavi.co.jp/a9hprzgc0000/,愛知県豊田市羽布町鬼ノ平1-16,東海環状自動車道豊田松平I.C. 車40分,うなぎ料理店,"平均予算：1,500円",,,,,,
貸切スペース ゴルフバー POYPOY（ポイポイ）,https://r.gnavi.co.jp/np7vzahu0000/?sc_dsp=rs_14945&sc_type=area&sc_area=jp,東京都港区六本木6-2-7,地下鉄日比谷線六本木駅 徒歩1分,完全予約制ゴルフバー,"平均予算：8,800円",店内,店内,店内,店内,,
Ohisama Cafe＆Shop,https://r.gnavi.co.jp/8c5es7ns0000/,奈良県御所市東松本10-13,近鉄南大阪線御所駅 徒歩1分,カフェ＆ショップ,平均予算：650円,,,,,,
ギャラリーカフェ ならの木,https://r.gnavi.co.jp/r1htya580000/,長野県北佐久郡御代田町馬瀬口1597-276,しなの鉄道御代田駅 車5分,カフェ,"平均予算：1,000円",,,,,,
アントン,https://r.gnavi.co.jp/dv3ws2bd0000/,千葉県成田市公津の杜3-6-4,京成本線公津の杜駅 徒歩3分,イタリアンレストラン,"平均予算：3,000円",,,,,,
THANKSGIVING DAY,https://r.gnavi.co.jp/n7kj4ha50000/,福岡県福岡市中央区大名1-15-35,西鉄天神大牟田線西鉄福岡（天神）駅 徒歩5分,本格イタリアンカフェ,"平均予算：1,500円",,,,,,
BRAVE,https://r.gnavi.co.jp/px5g0ek80000/,大阪府大阪市北区西天満5-11-22,大阪市営地下鉄南森町駅1番出口 徒歩5分,Ｃａｆｅ・イタリアン,"平均予算：2,500円",,,,,,
BAR on the corner,https://r.gnavi.co.jp/p0cy9xb10000/,兵庫県西宮市甲子園口3丁目4-20,,ショットバー,"平均予算：2,000円",,,,,,
アロニアの里・ピルカノ（美麗）,https://r.gnavi.co.jp/dxa7z9n90000/,北海道旭川市神居町富沢519-1,ＪＲ旭川駅 車20分,農家レストラン,"平均予算：1,000円",,,,,,
カフェレイ 大正館,https://r.gnavi.co.jp/ephuut6v0000/,静岡県浜松市南区白羽町276-3,ＪＲ東海道本線浜松駅 車8分,カフェ,"平均予算：1,000円",,,,,,
THE OCEANS 3710,https://r.gnavi.co.jp/g5drx3m80000/,福岡県北九州市若松区安屋3710,ＪＲ小倉駅 車 20分,海岸レストラン・カフェ,"平均予算：3,000円",,,,,,
舘山寺園,https://r.gnavi.co.jp/dge6d5j70000/,静岡県浜松市西区舘山寺町2229,ＪＲ東海道本線浜松駅 バス45分,和食,"平均予算：2,500円",,,,,,
源太,https://r.gnavi.co.jp/1j2yyjtg0000/,静岡県富士市大淵7657-15,東名高速道路富士I.C. 車25分,手打ちそば,"平均予算：1,000円",,,,,,
ガーデンパナ,https://r.gnavi.co.jp/4f60k4ky0000/,沖縄県石垣市崎枝239-14,新石垣空港,海が見えるカフェ,平均予算：650円,,,,,,
獅子銀 陶の郷店,https://r.gnavi.co.jp/875wuetm0000/,兵庫県丹波篠山市今田町上立杭3,JR福知山線相野駅 バス20分,和食店,"平均予算：1,200円",,,,,,
ＭｉｌｌｅＦｌｅｕｒ,https://r.gnavi.co.jp/jr1wsj4r0000/,茨城県つくば市栗原3893-1,つくばエクスプレスつくば駅 車10分,フランス料理,"平均予算：4,000円",,,,,,
菜々草,https://r.gnavi.co.jp/hbs8g8nc0000/,埼玉県さいたま市大宮区上小町522,JR京浜東北線大宮駅西口 徒歩10分,和食屋,"平均予算：5,000円",,,,,,
ブッチャーズ テーブル,https://r.gnavi.co.jp/6bvfvb1z0000/,東京都練馬区東大泉2-9-18,西武池袋線大泉学園駅北口 徒歩9分,ハンバーガー屋,"平均予算：1,500円",,,,,,
こおろぎ,https://r.gnavi.co.jp/bf69xuev0000/,新潟県長岡市殿町2-5-1,ＪＲ長岡駅西口 徒歩8分,喫茶店,平均予算：380円,,,,,,
炭火個室肉バル ブラチョーラ練馬,https://r.gnavi.co.jp/7bspkfvj0000/?sc_dsp=rs_12766&sc_type=area&sc_area=jp,東京都練馬区豊玉北5-32-1,西武池袋線練馬駅西口 徒歩3分,名物！熟成トマホーク！,"平均予算：3,000円",テラス,テラス,テラス,テラス,テラス,
酒楽酒酒酒 蔵,https://r.gnavi.co.jp/p5s6tbxc0000/?sc_dsp=rs_12754&sc_type=area&sc_area=jp,神奈川県川崎市中原区小杉町3-258,東急目黒線武蔵小杉駅 徒歩2分,6/1より通常営業再開,"平均予算：3,500円",テラス,テラス,テラス,テラス,テラス,
大衆酒場 ホームラン,https://r.gnavi.co.jp/grz3vary0000/?sc_dsp=rs_15716&sc_type=area&sc_area=jp,岐阜県岐阜市神田町9-18,ＪＲ岐阜駅 徒歩3分,毎日13時開店大衆酒場,"平均予算：2,000円",テラス,テラス,テラス,テラス,テラス,
青銅館,https://r.gnavi.co.jp/6v01bxhg0000/,秋田県鹿角郡小坂町小坂鉱山字古館9-3,東北自動車道小坂IC. 車5分,食堂・レストラン,"平均予算：1,300円",,,,,,
カリブ,https://r.gnavi.co.jp/b2xs71ae0000/,広島県安芸郡坂町鯛尾2-7-1,,イタリアン・洋食屋,"平均予算：3,500円",,,,,,
TAKATORI,https://r.gnavi.co.jp/dynx7rpz0000/,愛知県名古屋市西区名駅2-27-15-101,地下鉄東山線名古屋駅1番出口 徒歩4分,カフェ,平均予算：700円,,,,,,
居酒屋 三平,https://r.gnavi.co.jp/a323000/?sc_dsp=rs_12182&sc_type=area&sc_area=jp,東京都港区港南2-6-10,ＪＲ品川駅港南口 徒歩1分,美酒が揃う老舗居酒屋,"平均予算：3,000円",,,,,,
Wark,https://r.gnavi.co.jp/40cfe2s50000/,東京都八王子市台町4-43,,レーザーカット・カフェ,平均予算：500円,,,,,,
noma－noma,https://r.gnavi.co.jp/1rfu5v790000/,愛媛県松山市大街道1-4-20,伊予鉄道城南線大街道電停 徒歩5分,生ジューススタンド,平均予算：350円,,,,,,
レイクビュー,https://r.gnavi.co.jp/ng8cwcfk0000/,神奈川県足柄下郡箱根町箱根畑引山381-1,芦ノ湖スカイライン箱根峠出入口 車5分,そば、軽食店,"平均予算：1,000円",,,,,,
板前割烹 真亜房,https://r.gnavi.co.jp/kcngspu70000/,千葉県香取市佐原イ3412-1,ＪＲ成田線佐原駅 徒歩10分,板前割烹・和風創作料理,"平均予算：4,500円",,,,,,
ちゃかす,https://r.gnavi.co.jp/amt08k350000/,東京都荒川区東日暮里6-6-7,ＪＲ常磐線三河島駅 徒歩4分,和風居酒屋　家庭料理,"平均予算：2,500円",,,,,,
タピキング京都西院店,https://r.gnavi.co.jp/dkgwns900000/,京都府京都市中京区壬生西土居ノ内町19,,飲食店,平均予算：600円,,,,,,
盛蔵,https://r.gnavi.co.jp/hvtvxgps0000/,東京都豊島区上池袋1-9-5,ＪＲ池袋駅東口 徒歩9分,新鮮肉刺しと焼きとり,"平均予算：3,000円",,,,,,
石窯パン工房森のおくりもの,https://r.gnavi.co.jp/aysj7eu00000/,静岡県下田市横川1051-3,,山奥の石窯パン屋,"平均予算：1,300円",,,,,,
ロッヂ ハーネンカム,https://r.gnavi.co.jp/b9xs62ty0000/,長野県下高井郡野沢温泉村豊郷8455-2,JR飯山線戸狩野沢温泉駅 バス20分,ロッヂ　ハーネンカム,"平均予算：1,000円",,,,,,
茉莉花,https://r.gnavi.co.jp/hhv2v4r90000/,北海道函館市大手町8-4,函館市電市役所前駅 徒歩2分,本格的中国茶のCafe,平均予算：800円,,,,,,
Bucheron,https://r.gnavi.co.jp/134djaw10000/,東京都世田谷区大蔵1-16-17,小田急小田原線成城学園前駅 バス15分,軽食喫茶,"平均予算：1,000円",,,,,,
Little Falls,https://r.gnavi.co.jp/4cmdkfyu0000/,北海道札幌市北区新琴似2条5丁目3-13,北73新琴似2条線新琴似2－6停留所 徒歩3分,パスタと自家焙煎珈琲,"平均予算：1,100円",,,,,,
neo－capsule．com,https://r.gnavi.co.jp/m3x0uhux0000/,北海道旭川市曙1条2-2-2,ＪＲ旭川駅北口 徒歩10分,インテリア複合カフェ,平均予算：380円,,,,,,
ジャイプール,https://r.gnavi.co.jp/s7f0bejj0000/,神奈川県川崎市中原区木月1-29-13,東急東横線元住吉駅 徒歩5分,本格インド料理,"平均予算：1,800円",,,,,,
DARTS＆KARAOKE BAR D＆G,https://r.gnavi.co.jp/h8jy9ehz0000/,香川県高松市亀井町10-4,高松琴平電気鉄道 琴平線瓦町駅正面出口 徒歩5分,ダーツ　カラオケ　バー,"平均予算：1,500円",,,,,,
ガーデンカフェ,https://r.gnavi.co.jp/1sytg4za0000/,鳥取県西伯郡大山町鈑戸あけまの森1570,米子自動車道米子東I.C. 車15分,カフェレストラン,"平均予算：1,650円",,,,,,
茶囲布,https://r.gnavi.co.jp/41nkd5x40000/,栃木県那須郡那須町高久乙796-171,JR東北新幹線那須塩原駅西口 車25分,茶房＆ギャラリー,"平均予算：1,000円",,,,,,
Meson del Puerto,https://r.gnavi.co.jp/g303102/?sc_dsp=rs_14559&sc_type=area&sc_area=jp,埼玉県さいたま市大宮区桜木町1-5-3,ＪＲ大宮駅西口 徒歩1分,本場スペインバル,"平均予算：4,000円",,,,,,
やきとり 呑炭坊～どんたんぼう～ 武蔵小杉 はなれ,https://r.gnavi.co.jp/a461902/?sc_dsp=rs_12208&sc_type=area&sc_area=jp,神奈川県川崎市中原区新丸子東2-908-2,ＪＲ武蔵小杉駅 徒歩2分,信玄鶏の焼鳥・宮崎料理,"平均予算：3,000円",店内,店内,,,,
溶岩焼き×個室肉バル 29house 町田駅前店,https://r.gnavi.co.jp/jkbuubya0000/?sc_dsp=rs_14630&sc_type=area&sc_area=jp,東京都町田市原町田6-10-10,ＪＲ横浜線町田駅 徒歩1分,溶岩焼き×肉寿司,"平均予算：3,000円",店内,店内,店内,,,
Queen’sSoupCafe,https://r.gnavi.co.jp/k31hydpf0000/,三重県桑名市大央町37,近鉄名古屋線桑名駅西出口 徒歩15分,カフェ,"平均予算：1,000円",,,,,,
ほの香,https://r.gnavi.co.jp/hwka2kpp0000/,宮城県仙台市太白区富沢南1-4-10,仙台地下鉄南北線富沢駅 徒歩6分,コーヒー専門店,"平均予算：1,000円",,,,,,
おたるの味 「町の」寿司 本店,https://r.gnavi.co.jp/81w9yzk10000/,北海道小樽市稲穂1-1-1,ＪＲ函館本線小樽駅 徒歩8分,寿司屋,"平均予算：2,500円",,,,,,
イタリアンバルバンビーノ センター南店,https://r.gnavi.co.jp/bwndw20s0000/?sc_dsp=rs_13143&sc_type=area&sc_area=jp,神奈川県横浜市都筑区茅ヶ崎中央43-7,横浜市営地下鉄センター南駅 徒歩2分,話題のイタリアンバル,"平均予算：3,000円",テラス,テラス,テラス,テラス,テラス,
いよもんカフェ,https://r.gnavi.co.jp/nxmsemr10000/,滋賀県東近江市市子川原町716-2,,飲食店,"平均予算：1,400円",,,,,,
陽月,https://r.gnavi.co.jp/4gj9f7hx0000/,千葉県千葉市花見川区花園1-6-5,,BAR,"平均予算：2,000円",,,,,,
両子河原座,https://r.gnavi.co.jp/b6ef0xwb0000/,大分県国東市安岐町両子1594-1,ＪＲ日豊本線杵築駅 車30分,名物開運蕎麦,"平均予算：1,200円",,,,,,
おたカフェ,https://r.gnavi.co.jp/dv8px7ae0000/,東京都国分寺市西元町1-13-6,ＪＲ中央本線国分寺駅 徒歩15分,オープンテラスカフェ,"平均予算：1,000円",,,,,,
Greenarium Awajishima,https://r.gnavi.co.jp/7vj9djk30000/,兵庫県淡路市野島常盤1550-10,,農家レストラン・カフェ,"平均予算：1,000円",,,,,,
よりみちカフェ,https://r.gnavi.co.jp/79ud9xz10000/,新潟県柏崎市番神2丁目5-3,,カフェ,平均予算：400円,,,,,,
樹光庵,https://r.gnavi.co.jp/jfkt0e690000/,山梨県甲府市高成町999,,郷土料理店,"平均予算：1,000円",,,,,,
くにたち野菜工房 中道カフェ,https://r.gnavi.co.jp/bshyzwe00000/,東京都国立市富士見台4-12-11,,新鮮地場野菜の創作料理,"平均予算：3,000円",,,,,,
