くじゅう自然動物園,'九州'  '大分県',園内を自由に歩く動物たちと触れ合える,https://www.walkerplus.com/spot/ar1044s03812/    ,遊ぶ,'動物園・サファリパーク'  '子供と'  '恋人と・夫婦で'  '友達と',    大分県玖珠郡九重町田野1685-3[地図],    【電車】JR豊後中村駅からタクシーで約20分 【車】大分自動車道九重ICまたは湯布院ICから約30分,    3月下旬～11月中旬 10:00～17:00。11月下旬～3月中旬 10:00～16:30,    不定休    平日の雨天日や冬期の積雪日は休園となる場合あり,有料。 入園券 大人(高校生以上)1000円、小人(4歳～中学生)500円。団体割引(15名以上)大人800円、小人400円※PayPayの利用可, 0973-79-3005 くじゅう自然動物園,
神戸おとぎの国(道の駅神戸フルーツ・フラワーパーク大沢),'関西'  '兵庫県',おとぎの国のようなかわいらしい乗り物がいっぱい,https://www.walkerplus.com/spot/ar0728s14607/    ,遊ぶ,'遊園地・レジャー施設'  '道の駅'  '子供と'  '恋人と・夫婦で'  '友達と',    兵庫県神戸市北区大沢町上大沢2150[地図],    【電車】神戸電鉄岡場駅から神姫バスで約15分【車】六甲北有料道路大沢ICからすぐ,    3～11月 10:00～17:00。12月・1月および2月の土・日・祝 10:00～16:00。8月の土・日・祝およびお盆期間 10:00～18:00,    火曜(祝日の場合翌日。正月、春休み、GW、夏休みを除く)、2月の平日,入場無料。 乗り物200～400円、乗り物券5枚セット1300円, 078-954-1010,
加賀谷果樹園,'東北'  '秋田県',秋田県指導農業士が作る潟上市の果樹園,https://www.walkerplus.com/spot/ar0205s59066/    ,遊ぶ,'観光農園'  '子供と'  '恋人と・夫婦で'  '友達と',    秋田県潟上市天王字下出戸1-1[地図],    【電車】JR出戸浜駅から徒歩20分 【車】秋田自動車道昭和男鹿半島ICから約10分,    9:00～17:00,    開園期間中は無休,入園無料, 018-878-3053,要予約 団体は要予約
榎本牧場,'関東'  '埼玉県',絞りたてミルクのジェラートアイスは絶品,https://www.walkerplus.com/spot/ar0311s07578/    ,遊ぶ,'牧場・乗馬施設'  '子供と'  '恋人と・夫婦で'  '友達と',    埼玉県上尾市畔吉736-1[地図],    【電車】JR上尾駅から市内循環バスぐるっとくん平方丸山公園線に乗り約30分、畔吉下車徒歩5分 【車】首都圏中央連絡自動車道北本桶川ICから約10分,    9:30～17:00,    1～3月水曜、4～2月なし,入場無料。, 048-726-1306,
富士山 樹空の森,'東海'  '静岡県',混雑する時間の目安,https://www.walkerplus.com/spot/ar0622s03724/    ,遊ぶ,'公園'  '遊園地・レジャー施設'  '子供と'  '恋人と・夫婦で'  '友達と',    静岡県御殿場市印野1380-15[地図],    【電車】JR御殿場駅から富士急行バスで富士山樹空の森停留所下車すぐ 【車】東名高速道路御殿場ICから約20分,    3～11月9:00～17:00、12～2月9:00～16:00,    火曜(祝日の場合翌日)、年末年始、7月20日～8月31日は無休,入場無料。 天空シアター入場料 大人300円、小・中学生150円, 0550-80-3776,
ヤマホン そりまち農園,'甲信越'  '長野県'  '北須坂駅(長野県)',減農薬有機栽培ブドウ＆リンゴで安心！,https://www.walkerplus.com/spot/ar0420s60060/    ,遊ぶ,'観光農園'  '子供と'  '恋人と・夫婦で'  '友達と',    長野県須坂市大字日滝4304-2[地図],    【電車】長野電鉄北須坂駅から徒歩10分 【車】上信越自動車道須坂長野東ICから約10分または小布施PAスマートICから約5分,    8：30～18：00,    味覚狩り期間中なし,, 026-246-8550,
伊香保グリーン牧場,'関東'  '群馬県',混雑する時間の目安,https://www.walkerplus.com/spot/ar0310s07577/    ,遊ぶ,'牧場・乗馬施設'  '子供と'  '恋人と・夫婦で'  '友達と',    群馬県渋川市金井2844-1[地図],    【電車】JR渋川駅からバス(伊香保温泉行き、約15分)でグリーン牧場前停留所下車すぐ 【車】関越自動車道渋川伊香保ICから約15分,    9:00～16:00 (最終入場15:00)、12～2月末 10:00～16:00 (最終入場15:00),    1月上旬～2月末の月～金曜(祝日の場合は営業)    荒天時は臨時休業の場合あり,有料。 入場料 大人(中学生以上)1300円、小人(3歳以上)650円、高齢者(65歳以上 要証明書提示)800円。美術館ハラミュージアムアークとのセット券 大人1800円、大高生1500円、中学生1400円、小学生800円。 ゴールデンウィーク期間中、美術館が冬季休館中は販売を中止。クレジットカード対応は一部飲食施設と売店のみ, 0279-24-5335,
土岐三国山県立自然公園,'東海'  '岐阜県',瀬戸や尾張旭などの夜景が堪能できる穴場的スポット,https://www.walkerplus.com/spot/ar0621s05815/    ,遊ぶ,'公園'  '展望台・タワー'  '子供と'  '恋人と・夫婦で'  '友達と',    岐阜県土岐市鶴里町柿野3512-4[地図],    【電車】JR土岐市駅から車で40分 【車】東海環状自動車道せと品野ICから約20分,,    なし,入場無料。, 0572-52-2001 平日のみ,
ひるがのピクニックガーデン,'東海'  '岐阜県',自然豊かなひるがの高原で癒しのひととき,https://www.walkerplus.com/spot/ar0621s03871/    ,遊ぶ,'名所・旧跡'  '遊園地・レジャー施設'  '子供と'  '恋人と・夫婦で'  '友達と',    岐阜県郡上市高鷲町ひるがの4670-75[地図],    【車】東海北陸自動車道ひるがの高原SAスマートICから約10分,    9:00～17:00    最終入園受付16:00,    期間中無休,有料。 入園料 大人500円、子供(4歳～小学生)300円、3歳以下無料, 0575-73-2311,
矢口果樹園,'関東'  '茨城県',3種の果物狩りを楽しむことができる観光農園,https://www.walkerplus.com/spot/ar0308s58849/    ,遊ぶ,'観光農園'  '子供と'  '恋人と・夫婦で'  '友達と',    茨城県かすみがうら市下土田477[地図],    【車】常磐自動車道千代田石岡ICから約2分,    平日10:00～17:00、土日祝9:00～17:00,    毎週木曜日定休    木曜祝日の場合のみ営業,入場無料。 梨狩り、柿狩り 大人(中学生以上)660円、小人(小学生)550円、幼児(3～5歳)440円、3歳未満無料 栗拾い 大人(中学生以上)550円、小人(小学生)440円、幼児(3～5歳)330円、3歳未満無料, 0299-59-2323,
土山ぶどう園,'北陸'  '石川県',ブドウ狩りとバーベキューが楽しめる観光農園,https://www.walkerplus.com/spot/ar0517s58837/    ,遊ぶ,'観光農園'  '子供と'  '恋人と・夫婦で'  '友達と',    石川県加賀市豊町ロ-4[地図],    【電車】JR加賀温泉駅からタクシーで約10分 【車】北陸自動車道加賀ICまたは片山津ICから約15分,    8:00～18:00,    シーズン中はなし,ぶどう狩り料金 大人(中学生以上) 830～1240円 小人(小学生) 520～830円 幼児(3歳以上) 310～520円 品種により異なる　※2歳以下無料 持ち込みバーベキューハウス使用料 大人(中学生以上) 630円 小人(小学生) 420円 幼児(3歳以上) 210円 2歳以下無料, 0761-72-4617,要予約 バーベキュー利用時のみ要予約
蓮沼海浜公園 こどものひろば,'関東'  '千葉県',日本最長走行距離のミニトレインが話題,https://www.walkerplus.com/spot/ar0312s14591/    ,遊ぶ,'遊園地・レジャー施設'  '子供と'  '恋人と・夫婦で'  '友達と',    千葉県山武市蓮沼ホ368-1[地図],    【電車】JR松尾駅から千葉交通空港シャトルバス横芝屋形海岸行きに乗り約20分 蓮沼中下車徒歩10分 【車】首都圏中央連絡自動車道松尾横芝ICから約15分,    4～10月10:00～17:00。11～3月10:00～16:00,    平日※祝日、春・夏・冬休み期間、ゴールデンウィーク期間は営業。雨天休園,入場無料。 得々チケット1300円。もぎとりチケット(回数券)1000円(1200円分の利用ができます) ※ゴールデンウィーク期間中は得々チケット、もぎとりチケットの販売はなし, 0475-86-3171,
朝倉梨栗園,'北陸'  '福井県',広々とした平地の開放感溢れる農園,https://www.walkerplus.com/spot/ar0518s58734/    ,遊ぶ,'観光農園'  '子供と'  '恋人と・夫婦で'  '友達と',    福井県あわら市城3-33[地図],    【電車】 JR芦原温泉駅からタクシーで15分　【車】北陸自動車道金津ＩＣから20分,    土日祝日9:00～16:00 平日10:00～12:00    最終入園15:30,    月曜日    平日不定休,有料。 入園料 中学生以上 300円 小学生以下無料 栗料金 1kgあたり 1200円, 0776-79-1930,要予約 要予約。HPからメール、電話、FAXで予約
美作しいたけ園,'中国'  '岡山県',様々な味覚狩りが楽しめる体験型観光農園,https://www.walkerplus.com/spot/ar0833s58984/    ,遊ぶ,'観光農園'  '子供と'  '恋人と・夫婦で'  '友達と',    岡山県美作市北原37[地図],    【電車】JR林野駅よりタクシーで約10分 【車】中国自動車道美作ICより約10分,    9:00～17:00,    火曜,入園料 タケノコ狩り(4月～5月)1本 650円 ワラビ狩り(4月中旬～5月末) 300円 カブトムシ・クワガタ採取(7月～8月) 1080円 シイタケ狩り(個人) 無料　※量り売り円 シイタケ狩り(団体20名以上)1名 1575円 栗狩り(9月上旬～10月下旬) 1200円 入園料(グラウンドゴルフ) 1回 500円 1回(食事をした場合) 250円 会員(年間3000円)になると1年間やり放題, 0868-72-1315 美作しいたけ園,要予約 2週間～1ヶ月前までに電話にて
須金フルーツランド,'中国'  '山口県',個性豊かな農園が集まった一日遊べる観光農園,https://www.walkerplus.com/spot/ar0835s58575/    ,遊ぶ,'観光農園'  '子供と'  '恋人と・夫婦で'  '友達と',    山口県周南市須万[地図],    【電車】JR徳山駅から須金行きバスで約60分、中原バス停下車徒歩15分　【車】山陽自動車道徳山東ICから車で約40分,    7月上旬～10月下旬 9:00～17:00    最終受付16:00,    期間内無休,, 0834-86-2000 予約も同じ,0834-86-2000 予約も同じ
高ボッチ高原第2駐車場 展望広場,'甲信越'  '長野県',フリーキャンプサイトがオープン,https://www.walkerplus.com/spot/ar0420s76850/    ,遊ぶ,'展望台・タワー'  '子供と'  '恋人と・夫婦で'  '友達と',    長野県塩尻市片丘[地図],    【電車】JR塩尻駅からタクシーで約40分 【車】長野自動車道塩尻ICから約30分,    入場自由,    期間内なし,入場無料。, 0263-52-0886 塩尻市観光課,
澗満滝展望台,'甲信越'  '長野県',混雑する時間の目安,https://www.walkerplus.com/spot/ar0420s198483/    ,遊ぶ,'展望台・タワー'  '絶景・景勝地'  '子供と'  '恋人と・夫婦で'  '友達と',    長野県下高井郡山ノ内町大字平穏[地図],    【電車】長野電鉄湯田中駅から白根火山線・奥志賀高原線バスで澗満滝下車(5月下旬～11月上旬のみ)、徒歩2分 【車】上信越自動車道信州中野ICから約30分,,    なし,入場無料。, 0269-34-2404 志賀高原観光協会,
那須高原 南ヶ丘牧場,'関東'  '栃木県',混雑する時間の目安,https://www.walkerplus.com/spot/ar0309s07573/    ,遊ぶ,'牧場・乗馬施設'  '子供と'  '恋人と・夫婦で'  '友達と',    栃木県那須郡那須町湯本579[地図],    【電車】JR那須塩原駅からバス(関東バス那須湯本行きで約38分)一軒茶屋停留所下車、徒歩15分 【車】東北自動車道那須ICから約15分,    8:00～17:30,    なし,入場無料。 有料アトラクションあり, 0287-76-2150,
JAはぐくみ 榛名里見地区梨園,'関東'  '群馬県',群馬県一の梨生産量を誇る伝統ある農園,https://www.walkerplus.com/spot/ar0310s58570/    ,遊ぶ,'観光農園'  '子供と'  '恋人と・夫婦で'  '友達と',    群馬県高崎市下里見町293[地図],    【電車】JR高崎駅からタクシーで約20分 【車】関越道高崎ICから約30分,    9:00～17:00    最終入園16:00,    なし,入園料 一律 560円 梨2個試食付き, 027-343-1192 平日対応,
高島市マキノ農業公園マキノピックランド,'関西'  '滋賀県',果物狩りからバーベキューまで楽しめる観光果樹園,https://www.walkerplus.com/spot/ar0725s58922/    ,遊ぶ,'観光農園'  '子供と'  '恋人と・夫婦で'  '友達と',    滋賀県高島市マキノ町寺久保835-1[地図],    【電車】JRマキノ駅から高島市コミュニティバス マキノ高原線でマキノピックランド下車すぐ 【車】名神高速道路京都東ICから約90分、北陸自動車道木之本ICから約30分,    9:00～18:00    9:00～17:00 冬期,    水曜(祝祭日の場合は翌日)    ※お盆、年末年始、繁忙期は要確認,, 0740-27-1811 問い合わせおよび予約,0740-27-1811 問い合わせおよび予約
チヨダ園芸,'関東'  '茨城県',果実の種類が豊富で多彩な味覚狩りが楽しめる！,https://www.walkerplus.com/spot/ar0308s58932/    ,遊ぶ,'観光農園'  '子供と'  '恋人と・夫婦で'  '友達と',  〒315-0066 茨城県かすみがうら市中佐谷７４４−１,    【電車】JR神立駅から車で約15分 【車】常磐自動車道千代田石岡ICから約15分,    8:30～17:00,    なし,小人, 0299-59-5710 農園,
東板橋公園,'関東'  '東京都'  '板橋区役所前駅(東京都)'  '新板橋駅(東京都)'  '板橋本町駅(東京都)',動物園を備えた子供に人気の公園,https://www.walkerplus.com/spot/ar0313s77001/    ,遊ぶ,'公園'  '動物園・サファリパーク'  '子供と'  '恋人と・夫婦で'  '友達と',    東京都板橋区板橋3-50-1[地図],    【電車】都営地下鉄三田線板橋区役所前駅から徒歩8分,    終日開放,    なし,入場無料。, 03-3963-8003 東板橋公園管理事務所・板橋こども動物園,
山之上果実農業協同組合,'東海'  '岐阜県',眺望抜群の農園は梨が食べ放題！,https://www.walkerplus.com/spot/ar0621s59354/    ,遊ぶ,'観光農園'  '子供と'  '恋人と・夫婦で'  '友達と',    岐阜県美濃加茂市山之上町1093-78[地図],    【電車】JR美濃太田駅北口からタクシーで約10分 【車】東海環状自動車道美濃加茂ICから約5分,    9:00～17:00    入場受付15:00まで,    期間中無休,入園料(食べ放題) 大人(中学生以上) 1000円 小人(小学生) 800円 幼児(3歳以上) 600円 3歳未満無料、団体割引あり 団体(30名以上) 大人(中学生以上) 950円 小人(小学生) 750円 幼児(3歳以上) 550円 要予約, 0574-25-4101,
しろとり動物園,'四国'  '香川県',園内を自由に闊歩する放し飼いの動物と触れ合える,https://www.walkerplus.com/spot/ar0937s14719/    ,遊ぶ,'動物園・サファリパーク'  '子供と'  '恋人と・夫婦で'  '友達と',    香川県東かがわ市松原2111[地図],    【電車】JR讃岐白鳥駅からタクシーで約10分 【車】高松自動車道引田ICから約10分,    9:00～17:00    季節によって異なる,    繁忙期は第2、4水曜日が休園日。閑散期は毎週水曜日が休園日。    変更あり。要TEL確認,有料。 入園料 大人1300円、小人(3歳～小学生)600円、2歳以下無料, 0879-25-0998,
ぐりーんふらわー牧場・大胡,'関東'  '群馬県',四季折々の花も美しい赤城山麓に広がる牧場,https://www.walkerplus.com/spot/ar0310s74040/    ,遊ぶ,'牧場・乗馬施設'  '道の駅'  '子供と'  '恋人と・夫婦で'  '友達と',    群馬県前橋市滝窪町1369-1[地図],    【電車】上毛電気鉄道大胡駅からデマンドバスで約15分 【車】北関東自動車道駒形ICまたは関越自動車道赤城ICから約30分,    常時開放。花木農産物直売所さんぽ道3～9月9:30～17:00、10～2月9:30～16:30。レストハウスまきば(管理棟及び軽食堂)3～9月10:30～16:30、10～2月10:30～15:30,    年末年始    臨時休業あり,入場無料。 バーベキュー等の利用は有料, 027-283-5792 ぐりーんふらわー牧場・大胡(レストハウスまきば),
服部牧場,'関東'  '神奈川県',混雑する時間の目安,https://www.walkerplus.com/spot/ar0314s07583/    ,遊ぶ,'牧場・乗馬施設'  '子供と'  '恋人と・夫婦で'  '友達と',    神奈川県愛甲郡愛川町半原6087[地図],    【電車】小田急電鉄本厚木駅からバス(半原行き)で愛川大橋停留所下車、徒歩30分 【車】東名高速道路厚木ICから約40分。首都圏中央連絡自動車道相模原ICから約10分,    10:00～17:00,    3～10月は無休、11～2月は毎週金曜,入場無料。, 046-281-0917,
観光農園 南楽園,'関西'  '大阪府',混雑する時間の目安,https://www.walkerplus.com/spot/ar0727s58741/    ,遊ぶ,'観光農園'  '子供と'  '恋人と・夫婦で'  'いちご狩り',    大阪府堺市南区別所1457[地図],    【電車】南海電車泉北高速鉄道難波駅から30分、栂・美木多駅にて下車、南海バスに乗り別所南で下車、徒歩700m 【車】阪和自動車道堺ICから府道61号線を南へ7km、別所を左折後約2km,    10:00～16:00,    火曜(祝日の場合は翌日),入園料金(3月～9月)中学生以上 300円、小学生250円、幼児(乳児以外)200円。公式サイト内にてホームページ閲覧割引あり。平日学校関係者は団体特別料金あり。その他料金は公式サイトを確認, 072-298-5037,
利府町観光協会観光梨園,'東北'  '宮城県'  '利府駅(宮城県)',仙台から車で約30分の観光梨園,https://www.walkerplus.com/spot/ar0204s58583/    ,遊ぶ,'観光農園'  '子供と'  '恋人と・夫婦で'  '友達と',    宮城県宮城郡利府町加瀬字男鹿島台1-10[地図],    【電車】JR利府駅から徒歩20分 【車】三陸自動車道利府塩釜ICから約3分,    10:00～15:00    入園は～14:30,    不定休    台風等気候変動で閉園の場合あり,有料。 入園料 1名550円(2個もぎ取り付き), 022-356-3678 利府町観光協会※平日9:00～16:00,要予約 10名以上は要予約
池上会館屋上展望台,'関東'  '東京都'  '池上駅(東京都)',横浜の街並みから池上本門寺五重塔まで見渡せる,https://www.walkerplus.com/spot/ar0313s78764/    ,遊ぶ,'展望台・タワー'  '子供と'  '恋人と・夫婦で'  '友達と',    東京都大田区池上1-32-8[地図],    【電車】東急池上線池上駅から徒歩10分 【車】首都高速道路鈴ヶ森ランプから約15分,    屋上展望台 8:30～19:00,    12月29日～31日、臨時休館日,入場無料。, 03-3753-2241,
三方原観光りんご園,'東海'  '静岡県',温暖な静岡県でリンゴ狩りが楽しめる観光農園,https://www.walkerplus.com/spot/ar0622s58576/    ,遊ぶ,'観光農園'  '子供と'  '恋人と・夫婦で'  '友達と',    静岡県浜松市北区根洗町463[地図],    【電車】JR浜松駅からバスターミナル15番渋川・奥山行きで50分、根洗下車徒歩2分 【車】東名自動車道浜松西ICから国道257号線経由で15分,    09:00～17:00,    水曜日・木曜日,入園料 中学生以上 1100円 小学生 600円 3歳以上 300円 中学生以上は1キロのお土産と皮むき付き, 053-436-7178,要予約 団体は要事前予約
内海みかん狩り 鈴ケ谷センター,'東海'  '愛知県',ミカン狩りとバーベキューが同時に楽しめるミカン園,https://www.walkerplus.com/spot/ar0623s59068/    ,遊ぶ,'観光農園'  '子供と'  '恋人と・夫婦で'  '友達と',    愛知県知多郡南知多町大字内海字奥鈴ケ谷70-18[地図],    【電車】名鉄内海駅からタクシーで約5分 【車】南知多道路南知多ICから約1分,    8:00～17:00,    なし,入園料 大人(中学生以上) 1100円 小人(小学生) 650円 幼児(3～5歳) 450円 事前に電話予約をした場合は団体料金で入園可 団体割引料金(25名以上) 大人(中学生以上) 900円 小人(小学生) 500円 幼児(3～5歳) 300円 バーベキュー＋入園料 大人(中学生以上) 2000円 小人(小学生) 1500円, 0569-62-1497,要予約 バーベキューは要予約
観光 北田園,'関東'  '埼玉県',ブドウ狩りが楽しめる野球場並みに広い観光農園,https://www.walkerplus.com/spot/ar0311s59452/    ,遊ぶ,'観光農園'  '子供と'  '恋人と・夫婦で'  '友達と',    埼玉県所沢市北中1-234-9[地図],    【電車】西武池袋線小手指駅北口から徒歩20分 【車】関越自動車道所沢ICから入間市方面に約15分,    9:00～17:00    最終入園16:00,    水曜,ブドウ狩り入園料(試食付き) 中学生以上 200円 小学生以下 100円, 04-2922-9030,
リバティーリゾート久能山,'東海'  '静岡県',ショッピングにグルメ、カルチャーまで楽しめる総合温浴施設,https://www.walkerplus.com/spot/ar0622s397736/    ,遊ぶ,'レジャー・リゾート施設'  'テーマパーク・アミューズメントパーク'  '子供と'  '恋人と・夫婦で'  '友達と',    静岡県静岡市駿河区古宿294[地図],    【電車】JR静岡駅南口から久能山下行バスで古宿下車徒歩約11分(土日のみ)。JR静岡駅南口から東大谷行きバスで東大谷乗換、久能山下行で古宿下車徒歩約11分 【車】東名高速道路静岡ICから約20分、日本平久能山スマートICから約15分、清水ICから約30分,    8:00～23:00 最終受付21:30。土曜は～24:00,    第2・第4火曜    月によって変更になる可能性あり,町屋エリア無料。温浴エリア 大人500円～、子供400円～, 054-204-1310 時間帯によりつながりにくい場合あり,
乙原観光園,'関西'  '兵庫県',乙原の自然の中で栗狩りができる観光農園,https://www.walkerplus.com/spot/ar0728s59449/    ,遊ぶ,'観光農園'  '子供と'  '恋人と・夫婦で'  '友達と', 〒669-1503 兵庫県三田市乙原１０６５,    【電車】JR三田駅、新三田駅よりタクシーで約20分,    10:00～16:00 LO:15:00,    不定休,栗狩り 大人(中学生以上) 1600円 子供(4歳以上) 1000円 4歳以下無料, 079-566-0005,要予約 電話にて要予約
花咲山展望台,'東北'  '山形県',風情ある温泉街を見下ろすロケーションが人気,https://www.walkerplus.com/spot/ar0206s74642/    ,遊ぶ,'展望台・タワー'  '子供と'  '恋人と・夫婦で'  '友達と',    山形県上山市葉山[地図],    【電車】JRかみのやま温泉駅からタクシーで約10分 【車】東北中央自動車道山形上山ICから約20分,    入場自由,    なし,入場無料。, 023-672-0839 上山市観光物産協会,
磐梯高原 南ヶ丘牧場,'東北'  '福島県',バター作り体験やロシアの家庭料理が味わえる,https://www.walkerplus.com/spot/ar0207s07610/    ,遊ぶ,'牧場・乗馬施設'  '子供と'  '恋人と・夫婦で'  '友達と',    福島県耶麻郡猪苗代町大字磐根字遠山1039-38[地図],    【車】磐越自動車道猪苗代磐梯高原ICから約30分,    8:00～17:30    ※7月の平日は9:00〜16:00の縮小営業,    不定休、夏季は無休,入場無料。, 0242-65-2707,通年。1～3月は平日休み(団体予約などは平日でも対応可、詳細は要問合せ)
東濃まきば館,'東海'  '岐阜県',バーベキューが楽しめる自然あふれる高原牧場,https://www.walkerplus.com/spot/ar0621s07584/    ,遊ぶ,'牧場・乗馬施設'  '子供と'  '恋人と・夫婦で'  '友達と',    岐阜県恵那市長島町鍋山4-66[地図],    【電車】JR恵那駅からタクシーに乗り約30分 【車】中央自動車道恵那ICから約30分,    10:00～16:00,    月曜～金曜(祝日の場合除く),入場無料。, 080-1577-4307,要予約 バター作り、アイスクリーム作り体験、バーベキューの一部メニューは3日前までに予約が必要
グリーンタワー相模原,'関東'  '神奈川県',スカイツリーまで見える展望塔,https://www.walkerplus.com/spot/ar0314s77196/    ,遊ぶ,'展望台・タワー'  '子供と'  '恋人と・夫婦で'  '友達と',    神奈川県相模原市南区麻溝台2317-1[地図],    【電車】小田急線相模大野駅またはJR横浜線相模原駅からバスに乗り約27分総合体育館前下車徒歩2分、またはJR相模線原当麻駅から徒歩約20分 【車】相模原愛川ICから約5km,    グリーンタワー相模原(展望塔) 4～9月 9:00～16:30、10～3月 9:00～16:00,    グリーンタワー相模原・フィールドアスレチック・管理事務所は2・5・8・11月の各第4月曜    ※施設によって異なる(詳細は公式サイト参照),入場無料。, 042-777-3451 8:30～17:00,
