くぼ農園,'中国'  '岡山県',キャンプやジンギスカン料理も楽しめる！,https://www.walkerplus.com/spot/ar0833s14311/    ,遊ぶ,'観光農園'  '子供と'  '恋人と・夫婦で'  '友達と',    岡山県岡山市北区御津紙工2747-1[地図],    【電車】JR金川駅からタクシーで約15分【車】山陽自動車道岡山ICから約30分,    10:00～17:00,    年末年始,入場無料。 キャンプ(11月～8月)1区画3500円, 086-726-0511,要予約 10名以上の団体もしくは、バーベキュー、焼肉、キャンプ場利用者は3日前までに要予約
まほろば観光果樹園,'東北'  '山形県',時間無制限で旬の果物が食べ放題！,https://www.walkerplus.com/spot/ar0206s58844/    ,遊ぶ,'観光農園'  '子供と'  '恋人と・夫婦で'  '友達と', 〒992-0311 山形県東置賜郡高畠町金原１８３,    【電車】JR高畠駅から車で約10分。JR赤湯駅から車で約15分 【車】東北自動車道白石ICから約60分。東北自動車道福島飯坂ICから約60分,    9:30～16:30,    営業期間中は無休,有料。 サクランボ狩り料金 大人(中学生以上)1300円、子供(3歳以上)700円 ※時間制限40分 ブドウ狩り料金 大人(中学生以上)600円～2000円、子供(3歳以上)400円～1000円, 0238-52-0588,
郡山金魚資料館・やまと錦魚園,'関西'  '奈良県'  '近鉄郡山駅(奈良県)',全国有数の金魚の産地で金魚について学べる,https://www.walkerplus.com/spot/ar0729s16381/    ,遊ぶ,'水族館・アクアリウム'  '子供と'  '恋人と・夫婦で'  '友達と',    奈良県大和郡山市新木町107[地図],    【電車】近鉄郡山駅から徒歩約12分、またはJR郡山駅から徒歩約17分【車】西名阪自動車道郡山ICからは20分、大和まほろばスマートICからは約8分、第二阪奈道路中町ランプからは約20分,    9:00～17:00,    月曜,入場無料。, 0743-52-3418,
むつ湾展望台,'東北'  '青森県',釜臥山観光道路の途中にある展望駐車場,https://www.walkerplus.com/spot/ar0202s73767/    ,遊ぶ,'展望台・タワー'  '子供と'  '恋人と・夫婦で'  '友達と',    青森県むつ市大字田名部字矢立山[地図],    【電車】JR下北駅からタクシーで約35分 【車】八戸自動車道八戸ICから約3時間15分または東北自動車道青森ICから約3時間,    入場自由,    期間内なし,入場無料。, 0175-22-1111 むつ市 観光戦略課,
六甲山 天覧台,'関西'  '兵庫県',夜景鑑賞にも最適の展望台,https://www.walkerplus.com/spot/ar0728s73628/    ,遊ぶ,'展望台・タワー'  '子供と'  '恋人と・夫婦で'  '友達と',    兵庫県神戸市灘区六甲山町一ヶ谷1-32[地図],    【電車】阪神御影駅・JR六甲道駅・阪急六甲駅から神戸市バス16系統六甲ケーブル下行き15～30分(JR六甲道、阪急六甲からは26・106系統もあり)、六甲ケーブル乗り換え10分 【車】阪神高速道路3号神戸線魚崎出口・阪神高速道路5号湾岸線住吉浜出口から約30分,    7:10～21:00,    なし    季節により異なる,入場無料。, 078-861-5288 六甲ケーブル下駅,
桃茂実苑,'中国'  '岡山県',フルーツ王国！岡山最大クラスの観光農園,https://www.walkerplus.com/spot/ar0833s58916/    ,遊ぶ,'観光農園'  '子供と'  '恋人と・夫婦で'  '友達と',    岡山県赤磐市上市218-1[地図],    【電車】JR岡山駅より宇野バス山陽団地経由ネオポリス(東6丁目または西9丁目)行き下市下車徒歩3分 【車】山陽自動車道山陽ICから約5分。中国自動車道美作ICから約60分,    9:00～16:00    観光農園 8:30～18:00 直売店,    なし,桃狩り 1600円 2個狩り＋2個試食 食べ放題プラン(桃) 2600円 2個狩り＋食べ放題(30分) 食べ放題プラン(ブドウ) 2100円 1房(土産用)＋食べ放題(30分) 食べ放題プラン(瀬戸ジャイアンツ) 3000円 1房(土産用)＋食べ放題(30分), 086-955-1928,要予約 公式サイトまたは電話(予約専用：086-958-5444)で前日17:00までに要予約　※記載価格は事前予約ありの個人優待料金
ララミー牧場・八ヶ岳乗馬会,'甲信越'  '山梨県',初心者も上級者も楽しめる乗馬体験,https://www.walkerplus.com/spot/ar0419s07589/    ,遊ぶ,'牧場・乗馬施設'  '子供と'  '恋人と・夫婦で'  '友達と',    山梨県北杜市小淵沢町10106[地図],    【電車】JR小淵沢駅からタクシーに乗り約5分 【車】中央自動車道小淵沢ICから約5分,    9:00～12:00、13:30～17:00。11～3月は～16:00(受付は30分前まで),    火曜,入場無料。, 0551-36-3298,
新保観光農園,'九州'  '鹿児島県',ミカンやサツマイモ狩りが楽しめる観光農園,https://www.walkerplus.com/spot/ar1046s60059/    ,遊ぶ,'観光農園'  '子供と'  '恋人と・夫婦で'  '友達と',  〒957-0124 新潟県北蒲原郡聖籠町蓮野１０２７,    【車】県道35号永吉入佐鹿児島線川口交差点から東南へ3分。指宿スカイライン山田ICから12分,    8:00～17:00,    月～金曜(祝日の場合は営業),, 099-264-9156 夜遅くの電話は不可,要予約 電話受付
長峰公園 長峰展望台,'関東'  '群馬県',初夏のヤマツツジでも名高い、伊香保温泉を望む景勝地,https://www.walkerplus.com/spot/ar0310s76397/    ,遊ぶ,'展望台・タワー'  '子供と'  '恋人と・夫婦で'  '友達と',    群馬県渋川市伊香保町湯中子991-35[地図],    【電車】JR渋川駅から関越交通バス伊香保温泉行きに乗り伊香保榛名口下車、群馬バス榛名湖行きに乗り換え長峰公園前下車 【車】関越自動車道渋川市伊香保ICから約35分,    入場自由,    なし,入場無料。, 0279-24-0535 渋川総合公園管理事務所,
初恋の丘,'東北'  '山形県',山形市街を西側から一望する,https://www.walkerplus.com/spot/ar0206s72535/    ,遊ぶ,'展望台・タワー'  '子供と'  '恋人と・夫婦で'  '友達と',    山形県山形市大字滝平[地図],    【車】東北中央自動車道山形中央ICから約10分,    入場自由,    なし,入場無料。, 080-1830-5708 日･月曜18:00～20:00のみ対応可能,
神津牧場,'関東'  '群馬県',畜産の仕事を自由に見学できる学習型牧場,https://www.walkerplus.com/spot/ar0310s07576/    ,遊ぶ,'牧場・乗馬施設'  '子供と'  '恋人と・夫婦で'  '友達と',    群馬県甘楽郡下仁田町大字南野牧250[地図],    【電車】JR中込駅から千曲バスで初谷温泉下車、徒歩90分 【車】上信越自動車道下仁田ICから約40分,    8:00～17:00,    水曜日(GW・お盆・祭日は除く),入場無料。 宿泊、キャンプ、バーベキュー、各種体験などは有料, 0274-84-2363,
魚見塚展望台,'関東'  '千葉県',夜間のライトアップで華やかに変身,https://www.walkerplus.com/spot/ar0312s29960/    ,遊ぶ,'展望台・タワー'  '公園'  '子供と'  '恋人と・夫婦で'  '友達と',    千葉県鴨川市貝渚[地図],    【電車】JR安房鴨川駅から徒歩40分 【車】館山道君津ICから房総スカイライン・県道24号線経由約45分,    終日開放,    なし,入場無料。, 04-7092-1111 鴨川市役所,
内沼きのこ園,'関東'  '東京都',味・香り・食感が引き立つ原木自然栽培で育ったキノコが自慢！,https://www.walkerplus.com/spot/ar0313s58924/    ,遊ぶ,'観光農園'  '子供と'  '恋人と・夫婦で'  '友達と',    東京都青梅市成木1-90[地図],    【車】圏央道青梅ICから岩蔵温泉方面へ約15分,    10:00～17:00    最終入園16:00,    火曜(祝日の場合は翌日)    7、8月は火・水曜,入園料 大人 200円 小学生 100円 小学生未満は無料、中学生以上は大人料金, 0428-74-4528,要予約 7、8月の期間およびバーベキュー利用は要予約
サンタプレゼントパーク「ニコラス展望タワー」【休業中】,'北海道'  '北海道',旭川市街や大雪・十勝岳連峰が望める360度の眺望,https://www.walkerplus.com/spot/ar0101s72738/    ,遊ぶ,'展望台・タワー'  '子供と'  '恋人と・夫婦で'  '友達と',    北海道旭川市神居町富岡555-2[地図],    【電車】JR旭川駅から徒歩5分の1条8丁目バス停から道北バス旭台行きに乗りスキー場入口下車徒歩15分 【車】道央自動車道旭川鷹栖ICから約15分,    18:00～21:00    最終入場20:45,    月曜～木曜(祝日は営業）予定,専用道路通行料 普通車(徒歩、二輪車は通行不可) 1000円, 0166-63-3232 サンタプレゼントパーク「ニコラス展望タワー」,
荒牧りんご園,'関東'  '栃木県',東京から日帰り圏内で、みずみずしい完熟りんごを堪能できる,https://www.walkerplus.com/spot/ar0309s59357/    ,遊ぶ,'観光農園'  '子供と'  '恋人と・夫婦で'  '友達と',    栃木県宇都宮市石那田町416[地図],    【車】東北道 宇都宮ICから日光方面へ15分,    08:30～17:30,    なし,入場料　無料、1kg/500円の計り売り, 028-669-2528,
野村観光果樹園,'関東'  '栃木県',季節の果物を楽しめる果樹園,https://www.walkerplus.com/spot/ar0309s59446/    ,遊ぶ,'観光農園'  '子供と'  '恋人と・夫婦で'  '友達と',    栃木県佐野市上羽田町155[地図],    【電車】JR両毛線佐野駅から車で約10分 【車】東北自動車道佐野藤岡ICから約10分,    09:30～18:00,    不定休,入園料 300円 3才以上。団体割引きなし。, 0283-24-5590 (9:30～6:00),
マルダイ大場農園,'甲信越'  '長野県',混雑する時間の目安,https://www.walkerplus.com/spot/ar0420s59688/    ,遊ぶ,'観光農園'  '子供と'  '恋人と・夫婦で'  '友達と',    長野県下伊那郡松川町大島2319[地図],    【電車】JR伊那大島駅からタクシーで約10分 【車】中央自動車道松川ICから約2分,    8:30～18:00,    無休,入園料 200円(もぎとりのみ), 0265-36-3238,要予約 メールなどから要予約
カネカみかん狩り園,'東海'  '静岡県'  '尾奈駅(静岡県)',奥浜名湖エリアを見下ろす景色のいい高台にあるミカン園,https://www.walkerplus.com/spot/ar0622s59543/    ,遊ぶ,'観光農園'  '子供と'  '恋人と・夫婦で'  '友達と',    静岡県浜松市北区三ヶ日町下尾奈2241-1[地図],    【電車】天竜浜名湖鉄道尾奈駅から徒歩20分 【車】東名高速道路三ヶ日ICから約15分,    09:00～16:00,    なし,ミカン狩り料金 大人(中学生以上) 1200円 小学生 800円 幼稚園児 600円 大人はお土産付き, 053-525-1002 トヤママリン,090-2263-8214 予約番号
任坊山公園 みはらし台,'東海'  '愛知県'  '成岩駅(愛知県)',半田市街一望の夜景スポット,https://www.walkerplus.com/spot/ar0623s393498/    ,遊ぶ,'展望台・タワー'  '子供と'  '恋人と・夫婦で'  '友達と',    愛知県半田市南二ツ坂町1-10[地図],    【電車】名鉄河和線知多半田駅から徒歩20分、または成岩駅から徒歩20分 【車】知多半島道路半田中央ICまたは半田ICから約10分,    終日開放,    なし,入場無料。, 0569-84-0665 半田市 都市計画課,
吉原果樹園,'九州'  '鹿児島県',桜島を望む絶好のロケーションで味覚狩り！,https://www.walkerplus.com/spot/ar1046s58988/    ,遊ぶ,'観光農園'  '子供と'  '恋人と・夫婦で'  '友達と',    鹿児島県鹿児島市東桜島町521-11[地図],    【車】桜島港から国道224号を垂水方面へ10分,    10:00～16:00,    期間中なし,食べ放題 500円 持ち帰り料金（ビワ） 100g 100円 持ち帰り料金（ミカン） 約3kg 1000円, 090-8767-5224,
鈴木観光果樹園,'関東'  '茨城県',筑波名物！福来ミカンも直売,https://www.walkerplus.com/spot/ar0308s58871/    ,遊ぶ,'観光農園'  '子供と'  '恋人と・夫婦で'  '友達と',    茨城県石岡市小幡1783[地図],    【電車】JR石岡駅からバスで約30分 【車】常磐自動車道千代田石岡ICから約30分,,    期間中はなし,柿・リンゴ狩り入園料 大人(15歳以上) 400円 小人(5歳以上) 300円,,要予約 団体のみ要予約　※電話受付
東京乗馬倶楽部【一時休止】,'関東'  '東京都'  '参宮橋駅(東京都)'  '南新宿駅(東京都)'  '初台駅(東京都)'  '代々木駅(東京都)',明治神宮そばにある都心唯一の乗馬クラブ,https://www.walkerplus.com/spot/ar0313s58996/    ,遊ぶ,'牧場・乗馬施設'  '子供と'  '恋人と・夫婦で'  '友達と',    東京都渋谷区代々木神園町4-8[地図],    【電車】小田急電鉄参宮橋駅から徒歩2分 【車】首都高速道路代々木出入口から約10分,    9:00～17:45。代々木ポニー公園9:00～17:00、12～2月は～16:45,    月曜(祝日の場合は翌日),有料。 体験乗馬(利用は1回のみ) 平日3600円、土・日・祝5400円。ビジター騎乗料 平日一般9500円、学生7700円、土・日・祝一般10700円、学生8000円 ※ビジターは別途指導料(3600～8300円)が必要。その他内容により料金は異なる, 03-3320-6860 予約専用ダイヤル,03-3320-6860 予約専用ダイヤル
水島展望台,'中国'  '岡山県',瀬戸内海の多島美と工場夜景を眺望できる展望台,https://www.walkerplus.com/spot/ar0833s150213/    ,遊ぶ,'展望台・タワー'  '子供と'  '恋人と・夫婦で'  '友達と',    岡山県倉敷市呼松[地図],    【電車】JR児島駅から車で約30分 【車】瀬戸中央自動車道水島ICから約15分,    終日開放,    なし,入場無料。, 086-426-3411 倉敷市観光課,
嵐山公園展望台,'北海道'  '北海道',広大な風致公園にある旭川市街一望の展望台,https://www.walkerplus.com/spot/ar0101s72742/    ,遊ぶ,'展望台・タワー'  '子供と'  '恋人と・夫婦で'  '友達と',    北海道旭川市江丹別町嵐山・上川郡鷹栖町[地図],    【電車】JR旭川駅からタクシーで約25分 【車】道央自動車道旭川鷹栖ICから約10分,    終日開放,,入場無料。, 0166-55-9779 嵐山公園センター,
千葉県立富津公園 明治百年記念展望塔,'関東'  '千葉県',ユニークな形の展望塔で眺望を満喫する,https://www.walkerplus.com/spot/ar0312s78765/    ,遊ぶ,'展望台・タワー'  '子供と'  '恋人と・夫婦で'  '友達と',    千葉県富津市富津2280[地図],    【電車】JR青堀駅から富津公園行きバスで約15分 【車】館山自動車道木更津南出口から約20分,    終日開放,    なし,入場無料。, 0439-87-8887,
江の島シーキャンドル【臨時休業】,'関東'  '神奈川県',江の島のシンボル、湘南の大パノラマを,https://www.walkerplus.com/spot/ar0314s75439/    ,遊ぶ,'展望台・タワー'  '子供と'  '恋人と・夫婦で'  '友達と',    神奈川県藤沢市江の島2-3-28[地図],    【電車】江ノ島電鉄江ノ島駅から徒歩25分または小田急江ノ島線から片瀬江ノ島駅から徒歩20分,    9:00～20:00 最終入場19:30,    無休,有料。 昇塔料 大人500円、子供250円。江の島サムエル・コッキング苑入場料(大人200円、子供100円)が必要(江の島シーキャンドルは江の島サムエル・コッキング苑内にある), 0466-23-2444 9:00～20:00,
みづきブルーベリー 武藤農園,'北陸'  '石川県',摘み立てのブルーベリーが食べ放題！,https://www.walkerplus.com/spot/ar0517s59075/    ,遊ぶ,'観光農園'  '子供と'  '恋人と・夫婦で'  '友達と',    石川県鳳珠郡能登町福光[地図],    【車】のと里山海道能登空港ICから約45分,    9:00～16:00,    旧盆まで無休、その後は月・火・木・金曜は休園,入園料 大人(持ち帰り2パック付き) 1000円 小学生(持ち帰り1パック付き) 500円 幼児無料(要保護者同伴), 0768-72-0481,
淡路島牧場,'関西'  '兵庫県',入場無料の牧場で酪農体験ができる,https://www.walkerplus.com/spot/ar0728s07621/    ,遊ぶ,'牧場・乗馬施設'  '子供と'  '恋人と・夫婦で'  '友達と',    兵庫県南あわじ市八木養宜上1[地図],    【車】神戸淡路鳴門自動車道西淡三原ICから約15分または洲本ICから約20分,    9:00～17:00,    木曜不定休    臨時休業あり,入場無料。, 0799-42-2066,
池田牧場 遊牧民,'中国'  '広島県',牧場で牛の乳搾りや哺乳を体験,https://www.walkerplus.com/spot/ar0834s12786/    ,遊ぶ,'牧場・乗馬施設'  '子供と'  '恋人と・夫婦で'  '友達と',    広島県府中市上下町井永634-1[地図],    【電車】JR上下駅から車で5分 【車】尾道自動車道世羅ICから約15分。山陽自動車道福山東ICまたは中国自動車道庄原ICから約60分,    一般公開 4月下旬～10月の土・日・祝11:30～16:00,    一般公開日以外。臨時休業あり    公式ホームページ要確認,入場無料。, 0847-62-4369,
屋島獅子の霊巌,'四国'  '香川県',獅子の巌がある展望スポット,https://www.walkerplus.com/spot/ar0937s196845/    ,遊ぶ,'展望台・タワー'  '子供と'  '恋人と・夫婦で'  '友達と',    香川県高松市屋島山上[地図],    【車】屋島スカイウェイ出口より徒歩約５分,    6:30〜22:00 ※駐車場利用可能時間,    なし,入場無料。, 087-841-9443,
天橋立ビューランド,'関西'  '京都府'  '天橋立駅(京都府)',モノレールかリフト利用で行く展望遊園地,https://www.walkerplus.com/spot/ar0726s14605/    ,遊ぶ,'遊園地・レジャー施設'  '子供と'  '恋人と・夫婦で'  '友達と',    京都府宮津市字文珠437[地図],    【電車】京都丹後鉄道天橋立駅から徒歩5分 【車】京都縦貫自動車道与謝天橋立ICから約10分,    2月21日～7月20日・8月21日～10月20日 9:00～17:00／7月21日～8月20日 8:30～18:00／10月21日～2月20日 9:00～16:30    ※すべて通年,    なし,有料。 往復乗車料金(入園料含む) 大人(中学生以上)850円、 小人(小学生)450円。 大人1人につき、乳幼児1人無料、乳幼児2人目から小人料金, 0772-22-1000 (代表),
高千穂峡淡水魚水族館,'九州'  '宮崎県',高千穂の清らかな湧水を利用した水族館,https://www.walkerplus.com/spot/ar1045s16405/    ,遊ぶ,'水族館・アクアリウム'  '子供と'  '恋人と・夫婦で'  '友達と',    宮崎県西臼杵郡高千穂町御塩井(高千穂峡内)[地図],    【電車】JR延岡駅から宮崎交通バス高千穂バスセンター行きに乗り約80分 終点下車しタクシーに乗り約5分 【車】北方延岡道路北方ICから約45分,    9:00～16:00,    第2・第4水曜日    12月31日・1月1日休館,有料。 入場料 大人(高校生以上)300円、 小・中学生200円、3歳以上小学生未満100円、2歳以下無料。20名以上で団体割引あり, 0982-72-2269,
北海道ライオンアドベンチャー,'北海道'  '北海道'  'ニセコ駅(北海道)',アウトドア派も大満足の多彩なアクティビティ,https://www.walkerplus.com/spot/ar0101s14411/    ,遊ぶ,'レジャー・リゾート施設'  'テーマパーク・アミューズメントパーク'  '子供と'  '恋人と・夫婦で'  '友達と',    北海道虻田郡ニセコ町字中央通60-4[地図],    【電車】JRニセコ駅から徒歩5分 【車】札樽道余市ICから約65分 ※ニセコベースまでの所要時間,    夏季(4月～10月) 8:00～20:00、冬季(11月～3月) 9:00～17:00,    なし,有料。 プログラムにより異なる, 0136-43-2882,要予約 各体験前日までの要予約、当日は空きがあれば可
船越農園,'九州'  '福岡県',樹齢50年の絶品富有柿が評判,https://www.walkerplus.com/spot/ar1040s59557/    ,遊ぶ,'観光農園'  '子供と'  '恋人と・夫婦で'  '友達と',    福岡県うきは市吉井町鷹取1552-10[地図],    【車】大分自動車道朝倉ICから約40分,    9:00～17:00,    シーズン中無休,入場無料。 入園無料、摘み取り量り売り制。1kg500円～(季節により変動あり), 0943-75-2298,
達布山展望台,'北海道'  '北海道',明治の北海道開拓時代から知られた展望地,https://www.walkerplus.com/spot/ar0101s71814/    ,遊ぶ,'展望台・タワー'  '子供と'  '恋人と・夫婦で'  '友達と',    北海道三笠市いちきしり776-1[地図],    電車】JR岩見沢駅より中央バス幾春別行きに乗り大里口バス停下車徒歩30分 【車】道央自動車道三笠ICから約15分,    終日開放,    期間内なし,入場無料。, 01267-2-3591 三笠市教育委員会社会教育課 生涯教育係,
鳥海高原花立牧場公園,'東北'  '秋田県',鳥海山の麓に広がる大自然を満喫,https://www.walkerplus.com/spot/ar0205s07607/    ,遊ぶ,'牧場・乗馬施設'  '子供と'  '恋人と・夫婦で'  '友達と',    秋田県由利本荘市矢島町城内字花立96[地図],    【電車】由利高原鉄道矢島駅からタクシーで約20分。乗合タクシーあり 【車】日本海東北自動車道本荘ICから約45分。湯沢横手道路雄勝こまちICから約70分,    9:00～17:30    施設により異なる,    なし,入場無料。 施設により利用料あり, 0184-56-2408,
旅名観光農園フルーツ村,'関東'  '千葉県',オートキャンプやサバイバルゲームが楽しめる観光農園,https://www.walkerplus.com/spot/ar0312s59445/    ,遊ぶ,'観光農園'  '子供と'  '恋人と・夫婦で'  '友達と',    千葉県君津市旅名409[地図],    【電車】JR木更津駅よりバスで50分 【車】館山道君津ICから30分,    平日 10:00～16:00    土日祝 09:00～17:00,    不定休,●キウイ狩り 大人(10歳以上) 800円 子供(3歳以上9歳以下) 400円 2歳以下無料 ●梨狩り、栗狩り 大人(10歳以上) 1000円 子供(3歳以上9歳以下) 500円 2歳以下無料 ●入園料 大人(10歳以上) 300円 子供(3歳以上9歳以下) 150円 2歳以下無料 サツマイモ狩り　1株200円, 0439-38-2747,要予約 団体(20名以上は要予約)
白根大郷梨中村観光果樹園,'甲信越'  '新潟県',全国でも希少な洋梨狩りが楽しめる果樹園,https://www.walkerplus.com/spot/ar0415s59076/    ,遊ぶ,'観光農園'  '子供と'  '恋人と・夫婦で'  '友達と',    新潟県新潟市南区大郷1736-1[地図],    【電車】JR新津駅からタクシーで約15分 【車】北陸自動車道新潟西ICから約30分,    8:00～17:00,    なし,梨食べ放題 大人 500円 子供(5歳以上～小学生まで) 400円 入園料は無料, 025-362-5706,要予約 団体のみ要予約
伊豆スカイライン 西丹那駐車場,'東海'  '静岡県',伊豆スカイラインから富士山を眺めるベストスポット,https://www.walkerplus.com/spot/ar0622s152141/    ,遊ぶ,'展望台・タワー'  '恋人と・夫婦で'  '友達と',    静岡県田方郡函南町畑1-28[地図],    【電車】JR熱海駅より車で約30分またはJR三島駅より車で約45分 【車】小田原厚木道路小田原西IC・東名高速道路沼津IC・新東名高速道路長泉ICから約40分,    6:00～22:00,,通行料金 普通車(全線)1000円, 0558-79-0211 伊豆スカイライン,
エル・パティオ牧場,'九州'  '熊本県',阿蘇五岳を望む大草原の中で乗馬を満喫,https://www.walkerplus.com/spot/ar1043s07588/    ,遊ぶ,'牧場・乗馬施設'  'グルメ・飲食店'  '子供と'  '恋人と・夫婦で'  '友達と',    熊本県阿蘇市一の宮町三野2305-1[地図],    【電車】JR宮地駅からタクシーで約15分 【車】九州自動車道熊本ICまたは大分自動車道日田ICから約75分,    9:00～17:00 最終受付16:30。レストラン10:00～16:00,    なし,入場無料。 料金の詳細は公式サイトを確認。クレジットカードはVISA、Mastercard利用可, 0967-22-3861,
木曽馬の里･乗馬センター,'甲信越'  '長野県',生きた日本の文化財、木曽馬と触れ合う,https://www.walkerplus.com/spot/ar0420s07595/    ,遊ぶ,'牧場・乗馬施設'  '子供と'  '恋人と・夫婦で'  '友達と',    長野県木曽郡木曽町開田高原末川5596-1[地図],    【電車】JR木曽福島駅からおんたけ交通バスで木曽馬の里入り口下車木曽馬の里入り口下車、徒歩5～15分 【車】中央自動車道中津川ICから約90分または伊那ICから約50分。長野自動車道塩尻ICから約70分,    8:30～16:30,    なし,入場無料。 引き馬乗馬 ショートコース600円、ロングコース1100円。馬場内一人乗り15分2200円。場内トレッキング20分4400円, 0264-42-3085 8:30～16:30 (夏季および土･日などの乗馬時間は電話に出られない場合あり),
